UNLOCODE,Alternative UNLOCODEs,Terminal Code,Terminal Facility Name,Terminal Company Name,Latitude (DMS),Longitude (DMS),Last change,Valid from,Valid until,Terminal Website,Terminal Address,Remarks
NLRTM,,MST,NORTHSIDE,RTM-SHORTSEA TERM..,,,1574035200000000000,2005-02-23 00:00:00,1575072000000000000,,,
NLRTM,,RSC,RAIL SERVICE CENTER ROTTERDAM,RAIL SERVICE CENTER ROTTERDAM,N 51°52'20",E 004°25'42",1574035200000000000,2008-11-19 00:00:00,,https://www..rscrotterdam..nl,Albert Plesmanweg 200., 3088 GD Rotterdam (hoofdkantoor),
NLRTM,,KRM,ROTTERDAM CONTAINER TERMINAL (RCT) MAASVLAKTE,KRAMER TERMINAL,N 51°56'45",E 004°01'58",1574035200000000000,2014-08-05 00:00:00,,https://www..kramergroup..nl/rotterdam-container-terminal-rct/,Missouriweg 17., Port number 7220., 3199 LB Maasvlakte-Rotterdam., The Netherlands,
NLRTM,,RSN,ROTTERDAM SHORT SEA TERMINAL (RST) NORTH SIDE,ROTTERDAM SHORT SEA TERMINALS,N 51°52'49",E 004°25'25",1574035200000000000,2014-08-05 00:00:00,,https://rstshortsea..nl,Reeweg 35., Port number 2750., 3089 KM Rotterdam., The Netherlands,
NLRTM,,RSZ,ROTTERDAM SHORT SEA TERMINAL (RST) SOUTH SIDE,ROTTERDAM SHORT SEA TERMINALS,N 51°52'41",E 004°25'12",1574035200000000000,2014-08-05 00:00:00,,https://rstshortsea..nl,Reeweg 35., Port number 2750., 3089 KM Rotterdam., The Netherlands,
NLRTM,,NLSBH,ROTTERDAM STEINWEG BEATRIXHAVEN,STEINWEG BEATRIXHAVEN,N 51°53'01",E 004°24'50",1574035200000000000,2015-11-01 00:00:00,,https://netherlands..steinweg..com/en/beatrix-terminal/,Den Hamweg 30., Port number 2732., 3089 KK Rotterdam., The Netherlands,
NLRTM,,RWG,ROTTERDAM WORLD GATEWAY,ROTTERDAM WORLD GATEWAY,N 51°57'12",E 003°59'28",1574035200000000000,2014-08-05 00:00:00,,https://www..rwg..nl,Amoerweg 50., Port number 8970., 3199 KD Maasvlakte 2 Rotterdam., The Netherlands,
NLRTM,,RTM2,RTM - 2740,RTM - 2740,,,1574035200000000000,2005-02-23 00:00:00,1575072000000000000,,Reeweg 25., Port number 2740., 3089 KM Rotterdam., The Netherlands,
NLRTM,,RSZ,SOUTHSIDE,RTM-SHORTSEA TERM..,,,1574035200000000000,2005-10-07 00:00:00,1575072000000000000,,,
NLRTM,,UMTR,UNIPORT WAALHAVEN TERMINAL,UNIPORT MULTIPURPOSE TERMINALS B..V..,N 51°53'21",E 004°25'38",1574035200000000000,2016-05-13 00:00:00,,https://www..uniport..nl,Terminal Pier 5., 6 & 7 Waalhaven., Zaltbommelstraat 10., Port number 2530., 3089 JK Rotterdam., The Netherlands,
NLRTM,,DRN,VAN DOORN DEPOT ROTTERDAM,VAN DOORN DEPOT,N 51°56'23",E 004°00'33",1574035200000000000,2014-10-14 00:00:00,,https://dr-depots..com/,Malakkastraat 51., Port number 8564., 3199 LK Maasvlakte-Rotterdam., The Netherlands,
NLRTM,,RTMW,WAALHAVEN,RTM-WAALHAVEN,,,1574035200000000000,2005-02-23 00:00:00,1575072000000000000,,,
NLVLI,,KBV,KLOOSTERBOER VLISSINGEN B..V..,KLOOSTERBOER VLISSINGEN B..V..,N 51°28'30",E 003°42'28",,2018-01-22 00:00:00,,https://www..kloosterboer..com,,
NLVLI,,VZT,VERBRUGGE ZEELAND TERMINALS BV,VERBRUGGE ZEELAND TERMINALS BV,N 51°27'51",E 003°41'12",,2019-02-27 00:00:00,,https://www..verbrugge..nl,,
NOAES,,M423,KLOOSTERBOER TERMINAL ALESUND,KLOOSTERBOER TERMINAL NORWAY AS,,,,2006-01-18 00:00:00,1596153600000000000,,,Delete.. Unable to confirm the existence and location of the terminal..
NOAES,,KNAES,KN TERMINAL BREIVIKA,KUEHNE+NAGEL AS,,,,2006-01-27 00:00:00,1596153600000000000,,Breivika Industriveg 63., 6022 Alesund., Norway,Delete.. Unable to confirm the existence and location of the terminal..
NOAES,,SKUTVI,SKUTVIKA TERMINAL,TYRHOLM & FARSTAD AS,N 62°28'07",E 006°08'15",1582934400000000000,2015-03-25 00:00:00,,http://www..alesund..havn..no/en/Webkamera/Skutvika-havneanlegg,,
NOBGO,,NOBGON,GREENCARRIER TERMINAL,GREENCARRIER TERMINAL & LOGISTICS,,,,2016-05-13 00:00:00,1596153600000000000,,,Delete.. Unable to confirm the existence and location of the terminal..
NOFRK,,OERK,BORG HAVN FREDRIKSTAD-OERA,BORG HAVN IKS,N 59°10'58",E 010°57'15",1582934400000000000,2007-11-10 00:00:00,,https://www..borg-havn..no/gods-fredrikstad/,,
NOHAL,,ALKA,ALKATEL,NORSKE SKOG,,,,2007-11-10 00:00:00,1596153600000000000,,,Delete.. Unable to confirm the existence and location of the terminal..
NOHAL,,NOSK,SAUGBRUG,NORSKE SKOG,,,,2007-11-10 00:00:00,1596153600000000000,,,Delete.. Unable to confirm the existence and location of the terminal..
NOLAR,,NOLCT,LARVIK CONTAINER TERMINAL,LARVIK CONTAINER TERMINAL AS,N 59°02'20",E 010°02'28",1582934400000000000,2006-01-30 00:00:00,,https://larvik..havn..no/en/,Revet., 3263 Larvik., Norway,
NOMSS,,MCT,MOSS CONTAINER TERMINAL,MOSS CONTAINER TERMINAL AS,N 59°25'37",E 010°39'26",1582934400000000000,2009-09-28 00:00:00,,https://www..moss-havn..no/en-GB/Portarea/ports,,
NOMSS,,VAER,VAERLEKAIA,SCHIANDERS SHIPPING MOSS AS,,,,2007-11-10 00:00:00,1596153600000000000,,,Delete.. Unable to confirm the existence and location of the terminal..
NOOSL,,NSF,FILIPSTAD QUAY,NORSTEVE AS,N 59°54'26",E 010°42'55",1582934400000000000,2008-01-16 00:00:00,,http://oslohavn..no/no/meny/tjenester/kart-over-oslo-havn/,,
NOOSL,,OSW,ORMSUND QUAY,YILPORT OSLO A/S,N 59°52'55",E 010°45'55",1582934400000000000,2008-01-16 00:00:00,,http://oslohavn..no/no/meny/tjenester/kart-over-oslo-havn/,,
NOOSL,,SCT,SJURSOYA SOUTH QUAY,YILPORT OSLO A/S,N 59°53'11",E 010°45'08",1582934400000000000,2008-01-16 00:00:00,,http://oslohavn..no/no/meny/tjenester/kart-over-oslo-havn/,,
NOSKI,,HBRT,HARBOUR TERMINAL,GRENLAND HAVN IKS,,,,2007-11-10 00:00:00,1596153600000000000,,,Delete.. Unable to confirm the existence and location of the terminal..
NOTAE,,RIS,WESTPORT TERMINAL RISAVIKA,RISAVIKA TERMINAL AS,N 58°55'10",E 005°35'12",1585699200000000000,2015-03-25 00:00:00,,http://westport..no/,Kontinentalveien 19., 4056 Tananger., Norway,
NZAKL,,PABW,PORTS OF AUCKLAND BLEDISLOE WHARF,PORTS OF AUCKLAND LIMITED,S 36°50'30",E 174°46'21",,2004-05-31 00:00:00,,https://www..poal..co..nz/,,
NZAKL,,PAFW,PORTS OF AUCKLAND FERGUSSON WHARF,PORTS OF AUCKLAND LIMITED,S 36°50'27",E 174°47'00",,2004-05-31 00:00:00,,https://www..poal..co..nz/,,
NZAKL,,PAGW,PORTS OF AUCKLAND GENERAL WHARF,PORTS OF AUCKLAND LIMITED,S 36°50'33",E 174°46'45",,2004-05-31 00:00:00,,https://www..poal..co..nz/,,
NZLYT,,LPC,LYTTELTON PORT COMPANY,LYTTELTON PORT COMPANY LIMITED,S 43°36'32",E 172°43'42",,2004-05-31 00:00:00,,http://www..lpc..co..nz/,Cashin Quay., 2., Lyttelton 8082., New Zealand,
NZNPE,,NPENZ,NAPIER PORT,PORT OF NAPIER LTD..,S 39°28'31",E 176°55'01",1578009600000000000,2005-08-02 00:00:00,,https://www..napierport..co..nz/,818 Breakwater Road., Bluff Hill., Napier 4110., New Zealand,
NZNPL,,PTAR,PORT TARANAKI,PORT TARANAKI LTD..,S 39°03'25",E 174°02'03",,2014-07-10 00:00:00,,https://www..porttaranaki..co..nz/,2/8 Bayly Road., Port Taranaki., New Plymouth 4340., New Zealand,
NZNSN,,PNEL,PORT NELSON,PORT NELSON LTD..,S 41°15'41",E 173°16'16",,2014-07-10 00:00:00,,http://www..portnelson..co..nz/,8 Vickerman Street., Port Nelson., Nelson 7040., New Zealand,
NZPOE,,POOT,PORT CHALMERS,PORT OTAGO LTD..,S 45°48'45",E 170°37'33",1578009600000000000,2014-02-06 00:00:00,,https://www..portotago..co..nz/marine-and-shipping/berth-facilities/,15 Beach Street., Port Chalmers 9023., New Zealand,
NZTIU,,PTIM,PRIMEPORT TIMARU,PRIMEPORT TIMARU LTD..,S 44°23'23",E 171°15'20",,2014-07-10 00:00:00,,https://www..primeport..co..nz/home,Maritime House., 1 Marine Parade., Timaru 7910., New Zealand,
NZTRG,,MMP,MOUNT MAUNGANUI PORT,PORT OF TAURANGA LTD..,S 37°38'41",E 176°10'56",1578009600000000000,2004-05-31 00:00:00,,http://www..port-tauranga..co..nz/,2 Salisbury Avenue., Mount Maunganui., Tauranga 3116., New Zealand,
NZTRG,,TRGCT,TAURANGA CONTAINER TERMINAL (SULPHUR POINT),PORT OF TAURANGA LTD..,S 37°39'45",E 176°10'29",1578009600000000000,2005-08-03 00:00:00,,http://www..port-tauranga..co..nz/,66 Mirrielees Road., Sulphur Point., Tauranga 3110., New Zealand,
NZWLG,,CPW,CENTREPORT WELLINGTON,CENTREPORT WELLINGTON,S 41°16'44",E 174°47'22",,2014-10-27 00:00:00,,https://www..centreport..co..nz/,1 Hinemoa Street., HarbourQuays., Wellington 6011., New Zealand,
OMSLL,,APMT,APM TERMINALS SALALAH,APM TERMINALS,N 16°56'29",E 053°59'43",,2018-10-05 00:00:00,,https://www..apmterminals..com/en,,
OMSOH,,OICT,OMAN INTERNATIONAL CONTAINER TERMINAL,OMAN INTERNATIONAL CONTAINER TERMINAL LLC,N 24°30'54",E 056°36'34",1578009600000000000,2015-06-15 00:00:00,,http://www..oict..com..om/index..php,,
PABLB,,PPCBL,PANAMA PORTS COMPANY S..A..,PANAMA PORTS COMPANY S..A..,N 08°57'36",W 079°34'00",,2004-05-31 00:00:00,,,,
PACTB,,PCPPC,PANAMA PORTS COMPANY,PANAMA PORTS COMPANY PORT OF CRISTOBAL,N 09°21'15",W 079°54'32",,2004-05-31 00:00:00,,,,
PAMIT,,MIT,MANZANILLO INTERNACIONAL TERMINAL PANAMA S..A..,MANZANILLO INTERNACIONAL TERMINAL PANAMA S..A..,N 09°21'39",W 079°53'00",,2004-05-31 00:00:00,,,,
PAROD,,PPIT,PSA PANAMA INTERNATIONAL TERMINAL S..A..,PSA PANAMA INTERNATIONAL TERMINAL S..A..,N 08°57'39",W 079°34'32",,2004-05-31 00:00:00,,,,
PECLL,,APMCLL,APM TERMINALS CALLAO,APM TERMINALS CALLAO S..A..,S 12°02'42",W 077°08'39",1579824000000000000,2015-02-23 00:00:00,,https://www..apmterminalscallao..com..pe/default..aspx,,
PECLL,,DPCLL,DP WORLD CALLAO,DP WORLD CALLAO S..R..L..,S 12°03'15",W 077°08'58",,2004-05-31 00:00:00,,,,
PEPAI,,TPE,TERMINALES PORTUARIOS EUROANDINOS (TPE),TERMINALES PORTUARIOS EUROANDINOSPAITA S..A..,S 05°04'55",W 081°06'31",,2004-05-31 00:00:00,,,,
PFPPT,,POPA,PORT OF PAPEETE,PORT AUTONOME DU PAPEETE,S 17°32'14",W 149°34'34",,2004-05-31 00:00:00,,,,
PHCEB,,CIP,CEBU INTERNATIONAL PORT,CEBU INTERNATIONAL PORT,N 10°18'33",E 123°55'26",1579824000000000000,2015-06-12 00:00:00,,https://www..cpa..gov..ph/home,,
PHMNL,,MIC,MANILA INTERNATIONAL CONTAINER TERMINAL (MICT),INTERNATIONAL CONTAINER TERMINAL SERVICES., INC.. (ICTSI),N 14°36'04",E 120°57'16",1579824000000000000,2015-06-12 00:00:00,,https://www..mict..com..ph/#/mict-terminal,,
PHMNL,,NHDP,NORTH HARBOR DOMESTIC PORT,PORT OF MANILA,N 14°36'57",E 120°57'25",1579824000000000000,2015-06-12 00:00:00,,http://www..northport..ph/,,
PHMNL,,ATI,SOUTH HARBOR CONTAINER TERMINAL,ASIAN TERMINALS INC..,N 14°35'11",E 120°58'01",1579824000000000000,2005-09-19 00:00:00,,https://www..asianterminals..com..ph/ati_containerterminal..aspx,,
PKBQM,,QICT,QASIM INTERNATIONAL CONTAINER TERMINAL (QICT),QASIM INTERNATIONAL CONTAINER TERMINAL PAKISTAN LTD,N 24°45'52",E 067°19'40",1579824000000000000,2005-09-19 00:00:00,,http://www..dpworldkarachi..com/,,
PKKHI,,KICT,KARACHI INTERNATIONAL CONTAINER TERMINAL (KICT),KARACHI INTERNATIONAL CONTAINER TERMINAL,N 24°50'09",E 066°58'31",,2004-05-31 00:00:00,,https://www..kictl..com/,,
PKKHI,,PICT,PAKISTAN INTERNATIONAL CONTAINER TERMINAL (PICT),PAKISTAN INTERNATIONAL CONTAINER TERMINAL LIMITED,N 24°49'32",E 066°58'30",,2004-05-31 00:00:00,,,,
PLGDN,,DCT,DEEPWATER CONTAINER TERMINAL,DCT GDANSK SA,N 54°23'01",E 018°42'57",,2019-05-20 00:00:00,,https://www..dctgdansk..pl/en/,ul.. Kontenerowa 7., 80-601 Gdansk., Poland,
PLGDN,,PLGDA,GDANSKI TERMINAL KONTENEROWY (GTK),PORT OF GDANSK CARGO LOGISTICS SA,N 54°22'55",E 018°39'12",1582934400000000000,2006-01-16 00:00:00,,https://www..pge..pl/,Chodackiego 23., 80-555 Gdansk., Poland,Szczecinskie Quay
PLGDY,,PLBCT,BALTIC CONTAINER TERMINAL GDYNIA (BCT),BALTIC CONTAINER TERMINAL GDYNIA (BCT),N 54°32'40",E 018°30'41",1582934400000000000,2006-01-27 00:00:00,,http://www..bct..gdynia..pl/en/,Eugeniusza Kwiatkowskiego 60., 81-127 Gdynia., Poland,
PLGDY,,PLGCT,GDYNIA CONTAINER TERMINAL (GCT),GDYNIA CONTAINER TERMINAL S..A.. / HUTCHISON,N 54°32'34",E 018°30'28",1582934400000000000,2012-06-01 00:00:00,,https://www..gct..pl/en/,ul.. Energetyków 5 81-184 Gdynia., Poland,
PLSZZ,,DPSZ,SZCZECIN CONTAINER TERMINAL,DB PORT SZCZECIN,N 53°25'42",E 014°35'08",1582934400000000000,2006-01-16 00:00:00,,https://portszczecin..deutschebahn..com/dbportszczecin-en/container_terminal,,
PRSJU,,LACS,LUIS AYALA COLON,LUIS AYALA COLON SUCRS..., INC..,N 18°26'06",W 066°05'35",,2016-05-19 00:00:00,,,,
PTCNL,,CSP,CANICAL PORT., MADEIRA,ADMINISTRACAO DOS PORTOS DA REGIAO AUTONOMA DA MADEIRA., SA,N 32°44'12",W 016°44'00",1582934400000000000,2005-10-17 00:00:00,,http://www..apram..pt/site/index..php/en/ports/caracteristicas/port-of-canical,,
PTFDF,,LISC,FIGUEIRA DA FOZ TERMINAL,YIPLORT HOLDING INC..,N 40°08'49",W 008°50'51",1582934400000000000,2004-05-17 00:00:00,,https://www..yilport..com/en/ports/default/Figueira-Da-Foz-Portugal/112/0/0,,
PTFNC,,APRAM,FUNCHAL PORT., MADEIRA,ADMINISTRACAO DOS PORTOS DA REGIAO AUTONOMA DA MADEIRA., SA,N 32°38'31",W 016°54'32",1582934400000000000,2004-05-17 00:00:00,,http://www..apram..pt/site/index..php/en/ports/caracteristicas/port-of-funchal,Gare Marítima do Porto do Funchal., 9004-518 Funchal., Portugal,Not a commercial port., is mainly for cruise ships.. But has one RORO pier..
PTLEI,,TCLA,LEIXOES CONTAINER TERMINAL,TERMINAL DE CONTENTORES DE LEIXOES., SA / YILPORT HOLDING INC..,N 41°11'19",W 008°41'41",1582934400000000000,2009-12-08 00:00:00,,http://www..tcl-leixoes..pt/pt/terminais/,,North terminal at N41°11'07" W008°42'04"., south terminal at N41°11'36" W008°41'06"..
PTLIS,,TMB,BEATO MULTIPURPOSE TERMINAL (TMB),TERMINAL MULTIUSOS DO BEATO (TMB),N 38°43'53",W 009°06'15",1582934400000000000,2004-05-17 00:00:00,,http://www..tmb..pt/?lang=en,,
PTLIS,,OLIS,LISBON MULTIPURPOSE TERMINAL (TML),OPERLIS., SA,N 38°43'15",W 009°06'49",1582934400000000000,2004-05-17 00:00:00,,https://www..terminal-tsa..pt/,,
PTLIS,,LISC,LISCONT CONTAINER TERMINAL,YILPORT HOLDING INC..,N 38°41'57",W 009°10'07",1582934400000000000,2004-05-17 00:00:00,,http://www1..eurogate..de/en/EUROGATE/Terminals/Lisbon,Terminal de Contentores de Alcantara Sul., 1399-002 Lisbon., Portugal,Also known as "ALCANTARA CONTAINER TERMINAL (TCA)"..
PTLIS,,SOTA,SANTA APOLONIA CONTAINER TERMINAL (TCSA),SOTAGUS., SA,N 38°43'33",W 009°06'25",1582934400000000000,2004-05-17 00:00:00,,https://www..yilport..com/en/ports/default/Sotagus-Portugal/113/0/0,,
PTPXO,,APRAM,PORTO SANTO PORT,ADMINISTRACAO DOS PORTOS DA REGIAO AUTONOMA DA MADEIRA., SA,N 33°03'31",W 016°18'44",1582934400000000000,2004-05-17 00:00:00,,http://www..apram..pt/site/index..php/en/ports/caracteristicas/port-of-porto-santo,,
PTSET,,APSS,MULTI PURPOSE TERMINAL 1 - TERSADO,ADMINISTRACAO DOS PORTOS DE SETUBAL E SESIMBRA,N 38°31'08",W 008°52'49",1582934400000000000,2004-05-17 00:00:00,,https://www..portodesetubal..pt/Ingles/ingles_port_terminals..htm,,
PTSET,,SADOP,MULTI PURPOSE TERMINAL 2 - SADOPORT,SADOPORT - TERMINAL MARITIMO DO SADO S..A..,N 38°30'50",W 008°52'19",1582934400000000000,2010-11-23 00:00:00,,https://www..portodesetubal..pt/Ingles/ingles_port_terminals..htm,Terminal Multiusos Porto Setubal Zona 2., Setubal., 2910-793 Setubal., Portugal,
PTSIE,,SCT,SINES CONTAINER TERMINAL,SINES CONTAINER TERMINAL,N 37°55'59",W 008°50'48",1582934400000000000,2004-05-17 00:00:00,,https://www..portodesines..pt/en/,Administracao dos Portos de Sines e do Algarve., SA Apartado 16., EC Sines., 7521-953 Sines., Portugal,
PYASU,PYBCM,CCPMI,PUERTO CAACUPE-MI ASUNCION,SAN FRANCISCO S..A..,S 25°13'33",W 057°34'20",1574035200000000000,2017-04-27 00:00:00,,https://www..caa..com..py,Av.. Fernando Leri Reinhold y Hermann Gmeiner., Zeballos Cué Asunción., Paraguay,
PYASU,PYFNX,PFNX,PUERTO FENIX,PUERTO Y ESTIBAJES S..A..,S 25°13'25",W 057°34'09",1578009600000000000,2017-04-27 00:00:00,,https://www..puertofenix..com..py,,
PYASU,,PSJ,PUERTO SAN JOSE (EMPEDRIL S..A..),CONCRET-MIX S..A..,S 25°13'20",W 057°34'00",1578009600000000000,2017-04-27 00:00:00,,http://www..puertosanjose..com..py,,
PYPIL,,CAP,PUERTO CAACUPE-MI PILAR,CAACUPE-MI,S 26°52'20",W 058°19'43",1578009600000000000,2019-11-18 00:00:00,,https://www..caa..com..py/puertos/pilar/,José de Dalinquist., Bado Ñu; PILAR., Ñeembucu., Paraguay,
PYSAN,PYTER,TERSAN,TERPORT SAN ANTONIO,TERMINALES PORTUARIAS S..A (TERPORT),S 25°26'40",W 057°32'57",1578009600000000000,2017-04-27 00:00:00,,http://www..terport..com..py,,
PYVLL,,ANNP,ANNP TERMINAL PORTUARIA VILLETA,ADMINISTRACION NACIONAL DE NAVEGACION Y PUERTOS,S 25°30'29",W 057°34'32",1578009600000000000,2019-11-18 00:00:00,,http://www..annp..gov..py,,
PYVLL,,PSF,PUERTO SEGURO FLUVIAL,PUERTO SEGURO,S 25°32'52",W 057°33'55",1578009600000000000,2016-01-12 00:00:00,,http://www..puertosegurofluvial..com..py,,
PYVLL,,TERVIL,TERPORT VILLETA,TERMINALES PORTUARIAS S..A (TERPORT),S 25°36'42",W 057°36'32",1578009600000000000,2017-04-27 00:00:00,,http://www..terport..com..py,Ruta Villeta., Alberdi Km.. 13..5., Villeta., Paraguay,
QADOH,,DMP,DOHA MAIN PORT,DOHA MAIN PORT,,,1582934400000000000,2015-06-12 00:00:00,1585612800000000000,,,Container terminal operations moved from Doha port to the new Hamad port on 2016-12-01
QAHMD,,HCT,HAMAD CONTAINER TERMINAL (HCT),MWANI QATAR,N 25°02'22",E 051°36'02",,2018-05-25 00:00:00,,https://www..mwani..com..qa/english/pages/default..aspx,,
REPDG,,SAMR2,S..A..M..R.. (SOCIETE D'ACCONAGE ET DE MANUTENTION DE LA REUNION),CMA CGM / BOLLORE (SAMR / SGM / SOMACOM),S 20°55'54",E 055°18'56",,2018-10-15 00:00:00,,,,
ROCND,,CSCT,CONSTANTA SOUTH CONTAINER TERMINAL (CSCT),DP WORLD CONSTANTA,N 44°06'12",E 028°39'36",1576540800000000000,2015-06-12 00:00:00,,http://www..csct..ro/,,Berth 121
ROCND,,DPWCND,DP WORLD CONSTANTA,DP WORLD CONSTANTA,N 44°06'12",E 028°39'36",1579824000000000000,2016-05-13 00:00:00,1577750400000000000,http://www..csct..ro/,,Berth 121
ROCND,,SOCEP,SOCEP CONTAINER TERMINAL,SOCEP S..A.. CONTAINER TERMINAL,N 44°09'05",E 028°38'44",1579824000000000000,2015-06-12 00:00:00,,http://www..socep..ro/en/containers-terminal..htm,,Berth 51.,52
RULED,,CTSP,CONTAINER TERMINAL SAINT-PETERSBURG (CTSP),CONTAINER TERMINAL SAINT-PETERSBURG (CTSP),N 59°52'22",E 030°11'56",1578009600000000000,2014-11-10 00:00:00,,http://www..terminalspb..ru/en/,22., Elevatornaya ploschadka., Ugolnaya gavan., Saint-Petersburg., Russia., 198096,
RULED,,FCT,FIRST CONTAINER TERMINAL (FCT),FIRST CONTAINER TERMINAL,N 59°52'52",E 030°11'59",1578009600000000000,2003-12-03 00:00:00,,http://www..globalports..com/globalports/about-us/operating-segments/russian-ports,,Berths 82-87
RULED,,MOD,MOBY DIK TERMINAL., KRONSHTADT,MOBY DIK CO.. LTD..,N 60°00'05",E 029°42'26",1578009600000000000,2008-01-16 00:00:00,,http://www..globalports..com/globalports/about-us/operating-segments/russian-ports,Sea Port Complex., Kronshtadt., Saint-Petersburg., Russia., 197760,
RULED,,BRONKA,MSCC PORT BRONKA,MULTIPURPOSE SEA CARGO COMPLEX (MSCC) BRONKA,N 59°56'13",E 029°41'43",1578009600000000000,2015-12-29 00:00:00,,,,
RULED,,NVM,NEVA METAL TERMINAL (NMT),NEVA METAL,N 59°53'06",E 030°12'12",1578009600000000000,2015-07-01 00:00:00,,http://nevametal..com/eng,,Berths 71-74
RULED,,STPN,NORTHERN WHARF,RUSMARINE FORWARDING LTD..,N 59°52'42",E 030°13'35",1588291200000000000,2005-02-23 00:00:00,1590883200000000000,,,Berth SV-13.. Delete.. Rusmarine stopped operating the terminal in 2017., berth is now used as shipyard..
RULED,,PLP,PETROLESPORT TERMINAL,PETROLESPORT,N 59°53'28",E 030°13'32",1578009600000000000,2004-10-12 00:00:00,,http://www..globalports..com/globalports/about-us/operating-segments/russian-ports,,Berths 42.,43.,46-48.,56-58.,60-64
RULED,,SFP,SEA FISHING PORT TERMINAL,SEA FISHING PORT,N 59°52'09",E 030°12'46",1578009600000000000,2014-11-10 00:00:00,,http://www..seafishport..ru/,Elevator area., building 10., St.. Petersburg., Russia., 198096,Berths R1-R6
RULED,,STPF,SECOND STEVEDORING COMPANY (SSC),SECOND STEVEDORING COMPANY (SSC)., STP-1ST REGION,N 59°54'51",E 030°14'44",1582934400000000000,2005-06-27 00:00:00,,http://www..en..seaport..spb..ru/article/3/,,1..., 2.. and 3.. Steved.. Comp.. dissolved in 2011., merged to "Sea Port of Saint-Petersburg"..
RULED,,STPS,STP-2ND REGION,STP-2ND REGION,,,,2005-02-23 00:00:00,,http://www..en..seaport..spb..ru/article/3/,,1..., 2.. and 3.. Steved.. Comp.. dissolved in 2011., merged to "Sea Port of Saint-Petersburg"..
RULED,,STPB,STP-BTS-RAYON 4,STP-BTS-RAYON 4,,,1588291200000000000,2005-02-23 00:00:00,1590883200000000000,,,Delete.. Unable to locate., does not exist..
RUNVS,,NUTEP,NUTEP CONTAINER TERMINAL,DELOPORTS,N 44°43'18",E 037°48'58",1582934400000000000,2020-02-29 00:00:00,,http://www..nutep..ru/en/,Sukhumskoe shosse 17A., Novorossiysk., Russia., 353902,
RUULU,,ULCT,UST-LUGA CONTAINER TERMINAL (ULCT),GLOBAL PORTS,N 59°40'27",E 028°24'21",1578009600000000000,2014-11-10 00:00:00,,http://www..globalports..com/globalports/about-us/operating-segments/russian-ports,,
RUVVO,,PLCT,PACIFIC LOGISTIC CONTAINER TERMINAL,LLC "PACIFIC LOGISTIC",N 43°06'20",E 131°55'58",,2020-06-08 00:00:00,,http://www..pacific-logistic..ru/en,Dalzavodskaya Ulitsa., 2., korpus 14., Vladivostok., Primorsky Krai., Russia., 690001,Terminal commonly referred to as SOLLERS TERMINAL..
RUVVO,,VCT,VLADIVOSTOK CONTAINER TERMINAL (VCT),PJSC "COMMERCIAL PORT OF VLADIVOSTOK",N 43°05'25",E 131°52'05",,2020-06-08 00:00:00,,https://vmtp..ru/en/,Strelnikova Ulitsa., 9., Vladivostok., Primorsky Krai., Russia., 690065,Berths 14.,15.,16.. Company name in Russian: Vladivostokskiy Morskoy Torgovyy Port (VMTP)..
RUVYP,,VICS,VOSTOCHNAYA STEVEDORING COMPANY (VSC),GLOBAL PORTS,N 42°44'06",E 133°04'46",1578009600000000000,2005-09-19 00:00:00,1593475200000000000,http://www..vscport..ru/en-us/,Nakhodka., Primorsky Krai., Russia., 692943,Code change to VSC as VICS (Vostochny International Container Services) is no longer operator..
RUVYP,,VSC,VOSTOCHNAYA STEVEDORING COMPANY (VSC),GLOBAL PORTS,N 42°44'06",E 133°04'46",,2020-06-08 00:00:00,,http://www..vscport..ru/en-us/,Nakhodka., Primorsky Krai., Russia., 692943,
SADMM,,DCT,DAMMAM CONTAINER TERMINAL,INTERNATIONAL PORT SERVICES CO.. LTD..,N 26°30'18",E 050°11'49",1582934400000000000,2015-06-12 00:00:00,,https://www..ips..com..sa/,,First container terminal in the King Abdul Aziz port in Dammam
SAJED,,DPW,DP WORLD SOUTH CONTAINER TERMINAL JEDDAH (SCT),DP WORLD JEDDAH,N 21°27'17",E 039°09'30",1582934400000000000,2015-03-25 00:00:00,,https://www..dpworld..com/what-we-do/our-locations/Middle-East-Africa/Saudi-Arabia/arabia-jeddah,,
SAJED,,GCT,NORTHERN CONTAINER TERMINAL JEDDAH,GULFTAINER SAUDI ARABIA,N 21°28'45",E 039°09'28",1582934400000000000,2015-03-25 00:00:00,,,,
SAJED,,RSGT,RED SEA GATEWAY TERMINAL,RED SEA GATEWAY TERMINAL,N 21°29'04",E 039°09'17",1582934400000000000,2015-03-25 00:00:00,,http://rsgt..com/,,
SAJUB,,GSC,JUBAIL COMMERCIAL PORT,GULFTAINER SAUDI ARABIA,N 27°01'39",E 049°40'58",1582934400000000000,2015-09-21 00:00:00,,,,
SAKAC,,KACT,KING ABDULLAH NATIONAL CONTAINER TERMINAL (NCT),KING ABDULLAH PORT,N 22°31'34",E 039°05'33",1582934400000000000,2017-01-17 00:00:00,,https://www..kingabdullahport..com..sa/,,
SDPZU,,SPC,SOUTH PORT CONTAINER TERMINAL,SEA PORT CORPORATION,N 19°36'13",E 037°13'55",,2019-01-17 00:00:00,,http://sudanports..gov..sd/web/en/,,
SEAHU,,AHU,AHUS CONTAINER TERMINAL,AHUS HAMN STUVERI AB,N 55°55'41",E 014°19'28",1582934400000000000,2015-02-10 00:00:00,,https://www..ahushamn..se/en/index_en/,,
SEGOT,,CT1,APM TERMINALS GOTHENBURG,APM TERMINALS GOTHENBURG,N 57°41'19",E 011°51'22",1582934400000000000,2018-10-25 00:00:00,,https://www..apmterminals..com/gothenburg,,
SEGOT,,CAR,CAR TERMINAL GOTHENBURG,LOGENT PORTS & TERMINALS AB,N 57°41'29",E 011°52'02",1588291200000000000,2004-12-14 00:00:00,,https://logent..se/index..php/ports-terminals/,Port 2., Sydatlanten 30., 418 34 Göteborg., Sweden,
SEGOT,,RTG,RORO TERMINAL GOTHENBURG,DFDS A/S,N 57°41'26",E 011°50'09",1588291200000000000,2004-12-14 00:00:00,,https://www..dfds..com/en/freight-shipping/terminal-services/gothenburg-terminal,Ytterhamnsvägen 1., 418 34 Göteborg., Sweden,
SEGVX,,GVXFS,YILPORT CONTAINER TERMINAL GÄVLE,YILPORT GÄVLE CONTAINERTERMINAL AB,N 60°41'34",E 017°13'22",1537228800000000000,2007-10-31 00:00:00,,https://www..yilport..com,,
SEGVX,,GVXGU,YILPORT TERMINAL GRANUDDEN,YILPORT GÄVLE AB,N 60°41'23",E 017°14'13",1537228800000000000,2007-10-31 00:00:00,,https://www..yilport..com,,
SEHAD,,KTH,KATTEGAT TERMINAL HALMSTAD,HALLANDS HAMNAR AB,N 56°39'05",E 012°51'01",1585699200000000000,2008-01-16 00:00:00,,https://www..hallandshamnar..se/,Sibiriegatan 2., 302 50 Halmstad., Sweden,
SEHEL,,COTE,COMBI TERMINAL,HELSINGBORGS HAMN AB,N 56°02'08",E 012°41'45",1582934400000000000,2006-03-09 00:00:00,1585612800000000000,http://www..port..helsingborg..se/,Oljehamnsleden 60., 252 25 Helsingborg., Sweden,Not a maritime terminal..
SEHEL,,SKT,SKANE TERMINAL,HELSINGBORGS HAMN AB,N 56°01'14",E 012°42'10",1582934400000000000,2006-02-27 00:00:00,,http://www..port..helsingborg..se/,Oljehamnsleden 60., 252 25 Helsingborg., Sweden,
SEHEL,,VESTHA,WEST HARBOUR,HELSINGBORGS HAMN AB,N 56°01'50",E 012°41'35",1582934400000000000,2015-06-12 00:00:00,,http://www..port..helsingborg..se/,Oljehamnsleden 60., 252 25 Helsingborg., Sweden,
SEHEL,,VH,WEST HARBOUR,HELSINGBORGS HAMN AB,,,1582934400000000000,2006-02-27 00:00:00,1585612800000000000,http://www..port..helsingborg..se/,Oljehamnsleden 60., 252 25 Helsingborg., Sweden,Duplicate entry..
SEKPS,,RTK,RORO TERMINAL KAPELLSKÄR,PORTS OF STOCKHOLM,N 59°43'17",E 019°03'55",1585699200000000000,2006-03-09 00:00:00,,https://www..portsofstockholm..com/kapellskar/,Hamnterminalen., 760 15 Graddo., Sweden,
SEMMA,,CMPSE,CMP CONTAINER TERMINAL MALMÖ,COPENHAGEN MALMÖ PORT (CMP) NORRA HAMNEN AB,N 55°37'29",E 012°59'36",1582934400000000000,2006-05-11 00:00:00,,http://www..cmport..com/cmp-norra-hamnen/business-container,,
SENRK,,SEPCT,PAMPUS CONTAINER TERMINAL,PORT OF NORRKÖPING,N 58°37'23",E 016°14'36",1582934400000000000,2016-09-28 00:00:00,,https://www..norrkopingshamn..se/en/trafik-tjanster/terminalinfo_och_hamnkarta/pampusterminalen,Oceangatan 9., 602 38 Norrköping., Sweden,
SENYN,,RTN,RORO TERMINAL NYNÄSHAMN,PORT OF NYNÄSHAMN,N 58°54'25",E 017°57'24",1585699200000000000,2006-03-09 00:00:00,,https://www..portsofstockholm..com/nynashamn/,Skytten Hälls väg 10., 149 30 Nynäshamn., Sweden,
