UNLOCODE,Alternative UNLOCODEs,Terminal Code,Terminal Facility Name,Terminal Company Name,Latitude (DMS),Longitude (DMS),Last change,Valid from,Valid until,Terminal Website,Terminal Address,Remarks
ESLPA,,LMC,LINEAS MARITIMAS CANARIAS SA,LINEAS MARITIMAS CANARIAS SA,,,1582934400000000000,2005-08-18 00:00:00,1585612800000000000,,,Terminal closed in 2012., now in use by Boluda La Luz..
ESLPA,,OPCSA,OPERACIONES PORTUARIAS., S..A..,OPERACIONES PORTUARIAS., S..A..,N 28°07'59",W 015°24'53",1578009600000000000,2017-01-29 00:00:00,,http://www..opcsa..com/opcsacom/,Muelle de León y Castillo., 12., 35008 Las Palmas de Gran Canaria., Las Palmas., Spain,
ESMLN,,EPN,MELILLA PORT,MELILLA PORT,N 35°17'28",W 002°55'37",1582934400000000000,2005-10-07 00:00:00,,https://www..puertodemelilla..es/,,
ESMPG,,MPT,MARIN PORT TERMINAL,PEREZ TORRES MARITIMA S..L..,N 42°24'19",W 008°41'34",1582934400000000000,2015-11-01 00:00:00,,https://www..ptmar..com/en/puertos/puerto-marin,,
ESSAG,,INTERS,INTERSAGUNTO TERMINALES., S..A..,INTERSAGUNTO TERMINALES., S..A..,N 39°38'40",W 000°13'00",1578009600000000000,2017-01-29 00:00:00,,http://saguntoti..com/,Muelle Norte 2 S/N., 46520 Puerto de Sagunto., Valencia., Spain,
ESSCT,,CAPSA,BOLUDA MARITIME TERMINAL TENERIFE,BOLUDA CORPORACION MARITIMA S..A..,N 28°29'15",W 016°13'43",1582934400000000000,2005-08-22 00:00:00,,https://www..boluda..com..es/en/maritime-terminals/tenerife-en/,Carretera San Andrés., Muelle del Bufadero., 1., 38180 Santa Cruz de Tenerife., Spain,Boluda Corporacion Maritima acquired Compania Auxiliar del Puerto (CAPSA) in October 2017..
ESSCT,,ESTCT,CONTAINER TERMINAL TENERIFE (TCT),TERMINAL DE CONTENEDORES DE TENERIFE SA,N 28°29'21",W 016°13'25",1582934400000000000,2013-04-11 00:00:00,,http://www..tctenerife..es/en/,Nueva Terminal del Dique del Este., 38180 Santa Cruz de Teneriffe., Spain,
ESTAR,,DPWTA,DP WORLD TARRAGONA,DP WORLD TARRAGONA., S..A..,N 41°05'43",E 001°12'37",,2004-05-31 00:00:00,,,,
ESTAR,,FRUPO,FRUPORT S..A..,FRUPORT., S..A.. TERMINALES FRIGORIFICA,N 41°06'21",E 001°14'23",,2004-05-31 00:00:00,,,,
ESVGO,,TMI,TERMINALES MARITIMAS DE VIGO (TERMAVI),TERMINALES MARITIMAS DE VIGO S..L.. (TERMAVI),N 42°14'46",W 008°42'37",1582934400000000000,2005-10-07 00:00:00,,https://www..termavi..com/,Terminales maritimas de Vigo S..L..U., Muelle de Guixar., s/n., 36280 Vigo., Spain,
ESVLC,,TCV,APM TERMINALS VALENCIA (TCV),APM TERMINALS,N 39°27'08",W 000°19'07",1582934400000000000,2004-05-17 00:00:00,,https://www..apmterminals..com/valencia,,Established as "TCV Multipurpose Terminal" at the Levante Pier.. APMT acquired 75% in 2016..
ESVLC,,NOATV,CSP SPAIN VALENCIA TERMINAL,COSCO SHIPPING PORTS (SPAIN) TERMINALS S..L..U..,N 39°25'57",W 000°19'26",1582934400000000000,2004-05-31 00:00:00,,https://cspspain..com/en/valencia,,Noatum Ports rebranded itself to CSP Spain in April 2019..
ESVLC,,MSCVC,MSC TERMINAL VALENCIA,MEDITERRANEAN SHIPPING COMPANY TERMINAL VALENCIA S..A..,N 39°26'20",W 000°19'25",1582934400000000000,2004-05-31 00:00:00,,https://www..msctv..es/,,
FIHEL,,MLTHEL,MULTI-LINK TERMINAL VUOSAARI,MULTI-LINK TERMINALS LTD.. OY,N 60°12'44",E 025°11'31",1582934400000000000,2015-03-17 00:00:00,,http://mlt..fi/vuosaari/,,Vuosaari Harbour., D (West) Quay (southern part)., berths VDC/VD5
FIHEL,,FSHN,NORTH HARBOUR,FINNSTEVE OY AB,,,1585699200000000000,2006-03-13 00:00:00,1588204800000000000,,,Unable to locate.. Not listed on the Helsinki Port Authority website..
FIHEL,,FSHS,SOUTH HARBOUR,FINNSTEVE OY AB,,,1585699200000000000,2006-03-13 00:00:00,1588204800000000000,,Saukonkuja 5., 00180 Helsinki., Finland,Serves RoRo traffic travelling on passenger ships.. Remove because SMDG focuses on cargo ships..
FIHEL,,FSHVU,VUOSAARI HARBOUR., EAST QUAY,FINNSTEVE OY AB,N 60°12'55",E 025°11'35",1582934400000000000,2006-03-13 00:00:00,,http://www..finnsteve..com/location/helsinki,,Vuosaari Harbour., E (East) Quay., berths VEA/VEB/VEC/VED
FIHEL,,FIVCT,VUOSAARI HARBOUR., WEST QUAY,STEVECO OY,N 60°12'53",E 025°11'16",1582934400000000000,2008-10-27 00:00:00,,https://www..steveco..fi/en/index/toimipisteet/YKcus5Nvg..html,Satamakaari 35C., 00980 Helsinki., Finland,Vuosaari Harbour., D (West) Quay (northern part)., berths VDA/VDB
FIHEL,,FSHW,WEST HARBOUR,FINNSTEVE OY AB,,,1585699200000000000,2006-03-13 00:00:00,1588204800000000000,,,Serves RoRo traffic travelling on passenger ships.. Remove because SMDG focuses on cargo ships..
FIHMN,,FIHMN,PORT OF HAMINA,STEVECO OY,N 60°31'35",E 027°10'12",1582934400000000000,2006-02-27 00:00:00,,https://www..steveco..fi/en/index/toimipisteet/2YbuynxZs..html,Gerhardin väylä 4., 49460 Hamina., Finland,
FIKOK,,AWT,ALL WEATHER TERMINAL KOKKOLA,OY M RAUANHEIMO AB,N 63°50'40",E 023°01'11",1578009600000000000,2019-09-13 00:00:00,,https://www..rauanheimo..com/en/kokkola-2/,Satamatullintie 5., 67900 Kokkola., Finland,
FIKOK,,STE,SILVERSTONE PORT,PORT OF KOKKOLA LTD..,N 63°51'35",E 023°02'10",1578009600000000000,2019-09-13 00:00:00,,https://portofkokkola..fi/en/ports/silverstone-port/,Kantasatamantie 50., 67900 Kokkola., Finland,
FIKTK,,FIKCT,KOTKA CONTAINER TERMINAL,STEVECO OY,N 60°25'16",E 026°54'33",1585699200000000000,2006-02-27 00:00:00,,https://www..steveco..fi/en/index/toimipisteet/tphMBmr6K..html,Siikasaarentie 130., 48310 Kotka., Finland,Mussalo Harbour., C Quay
FIKTK,,MLTKTK,MULTI-LINK TERMINAL KOTKA,MULTI-LINK TERMINALS LTD.. OY,N 60°25'27",E 026°54'35",1585699200000000000,2015-03-17 00:00:00,,http://mlt..fi/,Merituulentie 424., 48310 Kotka., Finland,Mussalo Harbour., B Quay
FIKTK,,FSKM,MUSSALO PORT., B-QUAY,FINNSTEVE OY AB,,,1585699200000000000,2006-03-13 00:00:00,1588204800000000000,,,Delete.. Finnsteve Oy is no longer operating in Kotka..
FIKTK,,FIHIE,RORO TERMINAL HIETANEN,STEVECO OY,N 60°29'08",E 026°56'46",1582934400000000000,2006-02-27 00:00:00,,https://www..steveco..fi/en/index/toimipisteet/yIhKeO3ym..html,Hietasentie 123., 48200 Kotka., Finland,RoRo terminal
FIMTY,,FHCL,MANTYUOTO (PORT OF PORI),OY HACKLIN LTD..,N 61°35'49",E 021°28'12",1582934400000000000,2009-02-20 00:00:00,,https://www..hacklin..fi/page..php?lang=en&id=32,,
FIRAU,,REU,RAUMA PORT,RAUMA PORT,N 61°07'50",E 021°25'58",1582934400000000000,2015-10-09 00:00:00,,https://www..portofrauma..com/en,,
FITKU,,FSTP,PANSIO HARBOUR,FINNSTEVE OY AB,N 60°26'33",E 022°10'05",1582934400000000000,2006-03-13 00:00:00,,https://www..portofturku..fi/en/ports-operations/areas-and-maps/pansio-harbour/,,
FITKU,,FSTW,WEST HARBOUR,FINNSTEVE OY AB,N 60°26'17",E 022°12'45",1582934400000000000,2006-03-13 00:00:00,,https://www..portofturku..fi/en/ports-operations/areas-and-maps/west-harbour/,,
FJSUV,,POSU,PORT OF SUVA,FIJI PORT CORPORATION LIMITED,S 18°07'57",E 178°25'30",,2014-02-06 00:00:00,,,,
FRDKK,,TDF,TERMINAL DES FLANDRES., QUAI DE FLANDRE,TERMINAL DES FLANDRES,N 51°00'52",E 002°11'01",,2017-09-15 00:00:00,,https://www..terminal-des-flandres..com/en/,Port Ouest., 5895 Route du Royaume Uni., 59279 Loon-Plage., France,
FRFOS,,EURFO,EUROFOS,EUROFOS,N 43°24'24",E 004°51'01",,2004-05-31 00:00:00,,https://www..eurofos..fr/,,
FRFOS,,SEYA,SEAYARD,SEAYARD,N 43°25'11",E 004°49'48",,2004-05-31 00:00:00,,http://www..seayard..com/fr/,,
FRLEH,,TDF,TERMINAL DE FRANCE., QUAI DU HAVRE,GENERALE DU MANUTENTION PORTUAIRE (GMP),N 49°27'27",E 000°10'12",1579824000000000000,2006-06-08 00:00:00,,https://www..haropaports..com/en/container-terminals,,
FRLEH,,QATL,TERMINAL DE L'ATLANTIQUE., QUAI DE L'ATLANTIQUE,COMPAGNIE NOUVELLE DE MANUTENTIONS PORTUAIRES (CNMP),N 49°28'25",E 000°09'13",1579824000000000000,2004-05-31 00:00:00,,https://www..haropaports..com/en/container-terminals,,
FRLEH,,TMS,TERMINAL DE NORMANDIE MSC (TNMSC),TERMINAUX DE NORMANDIE,N 49°27'41",E 000°08'29",1579824000000000000,2012-04-02 00:00:00,,https://www..haropaports..com/en/container-terminals,,
FRLEH,,EUP,TERMINAL NORD., QUAI DE L'EUROPE,GENERALE DU MANUTENTION PORTUAIRE (GMP),N 49°28'53",E 000°10'41",1579824000000000000,2005-10-07 00:00:00,,https://www..haropaports..com/en/container-terminals,,
FRLEH,,AMQ,TERMINAL NORD., QUAI DES AMERIQUES,GENERALE DU MANUTENTION PORTUAIRE (GMP),N 49°28'34",E 000°09'55",1579824000000000000,2005-10-07 00:00:00,,https://www..haropaports..com/en/container-terminals,,
FRLEH,,TPO,TERMINAL PORTE OCEANE,TERMINAUX DE NORMANDIE,N 49°27'35",E 000°09'14",1585699200000000000,2006-10-27 00:00:00,,https://www..haropaports..com/en/container-terminals,Zone Port 2000., Route de l’Estuaire Port Sud., 76600 Le Havre., France,
FRMTX,,TGO,TERMINAL DU GRAND OUEST., QUAI DE MONTOIR,TERMINAL DU GRAND OUEST (TGO),N 47°18'00",W 002°09'00",,2017-11-23 00:00:00,,https://www..tgo-terminal..com,,
GAOWE,,NGI,NEW GABON INTERNATIONAL PORT,GSEZ CARGO PORT S..A,N 00°17'03",E 009°30'24",,2017-04-03 00:00:00,,https://www..olamgroup..com,,
GBBEL,,BCT,BELFAST CONTAINER TERMINAL,BELFAST CONTAINER TERMINAL,,,1588291200000000000,2015-09-21 00:00:00,1590883200000000000,,,Delete.. Duplicate with Victoria Terminal 3..
GBBEL,,VIC3,VICTORIA TERMINAL 3 (VT3),BELFAST CONTAINER TERMINAL,N 54°37'56",W 005°53'05",1578009600000000000,2015-05-22 00:00:00,,https://www..icg..ie/our-businesses/container-terminal/belfast-container-terminals/,19 W Bank Rd., Belfast BT3 9JL., United Kingdom,
GBFXT,,DLY,DOOLEY RORO TERMINAL,PORT OF FELIXSTOWE,N 51°57'07",E 001°18'51",1578009600000000000,2004-05-31 00:00:00,,,,
GBFXT,,LNG,LANDGUARD TERMINAL,PORT OF FELIXSTOWE,N 51°56'33",E 001°19'12",1578009600000000000,2004-05-31 00:00:00,,,,
GBFXT,,1RR,P&O FERRIES,P&O FERRIES,,,1578009600000000000,2004-05-31 00:00:00,1580428800000000000,,,
GBFXT,,2RR,P&O FERRIES,P&O FERRIES,,,1578009600000000000,2004-05-31 00:00:00,1580428800000000000,,,
GBFXT,,3RR,RORO,P&O FERRIES,,,1578009600000000000,2004-05-31 00:00:00,1580428800000000000,,,
GBFXT,,4RR,RORO,P&O FERRIES,,,1578009600000000000,2004-05-31 00:00:00,1580428800000000000,,,
GBFXT,,TTY,TRINITY TERMINAL,PORT OF FELIXSTOWE,N 51°57'38",E 001°17'48",1578009600000000000,2004-05-31 00:00:00,,,,
GBGRG,,GBGR,GRANGEMOUTH TERMINAL,GRANGEMOUTH TERMINAL,N 56°01'27",W 003°41'57",1578009600000000000,2004-05-31 00:00:00,,https://www..forthports..co..uk/our-ports/grangemouth/,,
GBGRK,,CLYDE,CLYDEPORT CONTAINER TERMINAL,PEEL PORTS CLYDEPORT CONTAINER TERMINAL,N 55°57'21",W 004°45'43",1578009600000000000,2017-03-09 00:00:00,,https://www..peelports..com/ports/clydeport,,
GBHUL,,HCT,QUEEN ELIZABETH DOCK,HULL CONTAINER TERMINAL,N 53°44'20",W 000°15'47",1578009600000000000,2006-07-10 00:00:00,,,,
GBLGP,,DPWLG,LONDON GATEWAY,DP WORLD,N 51°30'26",E 000°29'00",,2014-02-06 00:00:00,,,,
GBLIV,,COAST,COASTAL CONTAINER LIVERPOOL,COASTAL CONTAINER TERMINAL LTD,,,1588291200000000000,2015-05-22 00:00:00,1590883200000000000,,,Delete.. Duplicate., identical to Royal Seaforth Container Terminal (RSCT)..
GBLIV,,GBLIV,LIVERPOOL TERMINAL,LIVERPOOL TERMINAL,,,1588291200000000000,2004-05-31 00:00:00,1590883200000000000,,,Delete.. Duplicate., identical to Royal Seaforth Container Terminal (RSCT)..
GBLIV,,RSCT,ROYAL SEAFORTH CONTAINER TERMINAL (RSCT),MERSEY DOCKS & HARBOUR COMPANY LTD..,N 53°27'41",W 003°01'18",1582934400000000000,2015-05-22 00:00:00,,https://www..peelports..com/ports/liverpool,Royal Seaforth Container Terminal., Liverpool L21 1JD., United Kingdom,Berths 3-6
GBRCS,,LTP,LONDON THAMESPORT CONTAINER TERMINAL,HUTCHISON PORT HOLDINGS (HPH),N 51°25'58",E 000°41'11",,2004-05-31 00:00:00,,http://www..londonthamesport..co..uk/,Grain Rd., Rochester ME3 0EP., United Kingdom,
GBSOU,,DPWS,DP WORLD SOUTHAMPTON,DP WORLD,N 50°54'26",W 001°27'26",1578009600000000000,2015-05-22 00:00:00,,,,
GBSOU,,SCT,SOUTHAMPTON CONTAINER TERMINAL,SOUTHAMPTON CONTAINER TERMINALS LTD,N 50°54'26",W 001°27'26",1578009600000000000,2005-09-19 00:00:00,1580428800000000000,,,
GBTEE,,TEES,TEESPORT CONTAINER TERMINAL,PD PORTS TEESPORT CONTAINER TERMINAL,N 54°36'20",W 001°09'29",1588291200000000000,2017-03-09 00:00:00,,https://www..pdports..co..uk/locations/teesport/,,Two terminals: TCT1 at N54°36'06"N W001°09'06" and TCT2 at N54°36'28"N W001°09'18"..
GBTIL,,LCT,LONDON CONTAINER TERMINAL,LONDON CONTAINER TERMINAL LTD..,N 51°27'35",E 000°20'13",1578009600000000000,2015-09-21 00:00:00,,https://www..londoncontainerterminal..com/,,
GBTIL,,TCS,TILBURY CONTAINER SERVICES,TILBURY CONTAINER SERVICES LTD,,,1588291200000000000,2005-09-19 00:00:00,1590883200000000000,,,Delete.. No longer exists., is London Container Terminal (LCT) now..
GEPTI,,APMT,APM TERMINALS POTI,APM TERMINALS POTI SEA PORT,N 42°09'08",E 041°39'12",,2020-01-24 00:00:00,,https://www..apmterminals..com/en/poti,52 David Aghmashenebeli Street., Poti 4401., Georgia,The inner pier at N42°09'16" E041°39'53" is also used by APMT..
GHTEM,,MPS,MERIDIAN PORT SERVICES,MERIDIAN PORT SERVICES LTD (BOLLORE., APMT),N 05°37'31",E 000°00'31",,2015-09-22 00:00:00,,http://www..mps-gh..com,,
GHTEM,,MPS3,MERIDIAN PORT SERVICES (MPS) TERMINAL 3,MERIDIAN PORT SERVICES LTD,N 05°36'47",W 000°00'47",1588291200000000000,2019-07-05 00:00:00,,http://www..mps-gh..com,Meridian Port Services Limited; P..O..BOX TT240., Tema New Town – Ghana;Tel: +233 (0) 307 085 000,
GHTEM,,GPHA,TEMA MAIN HARBOUR,TEMA MAIN HARBOUR,N 05°37'49",E 000°00'32",,2015-09-22 00:00:00,,,,
GHTKD,,TKD1,TAKORADI PORT,GHANA PORTS AND HARBOURS AUTHORITY (TEMA PORT),N 04°53'09",W 001°44'17",,2020-05-01 00:00:00,,http://www..ghanaports..gov..gh,Ghana Ports and Harbours Authority., P..O.. Box CO488., Tema., Ghana; +233 (0) 303 219 120,
GIGIB,,GIBNM,GIBRALTAR NORTH MOLE., BERTH 6,M..H.. BLANDS STEVEDORING CO..., LTD..,N 36°08'52",W 005°21'50",1579824000000000000,2004-05-31 00:00:00,,https://www..gibraltarport..com/,,
GRPIR,,GRPCT,PIRAEUS CONTAINER TERMINAL,PIRAEUS CONTAINER TERMINAL SA,N 37°57'36",E 023°35'09",,2015-03-11 00:00:00,,http://www..pct..com..gr,,
GRPIR,,PPA,PIRAEUS PORT AUTHORITY SA,PIRAEUS PORT AUTHORITY SA,N 37°57'17",E 023°35'22",,2004-05-31 00:00:00,,,,
GRSKG,,THPASA,PORT AUTHORITY THESSALONIKI,PORT AUTHORITY THESSALONIKI,N 40°38'08",E 022°54'22",1582934400000000000,2015-09-21 00:00:00,,https://www..thpa..gr/,,
GTPBR,,TFPB,TERMINAL FERROVIARIA PUERTO BARRIOS,TERMINAL FERROVIARIA PUERTO BARRIOS,N 15°44'04",W 088°36'21",,2015-02-11 00:00:00,,,,
GTPRQ,,EPQEZ,EMPRESA PORTUARIA QUETZAL,EMPRESA PORTUARIA QUETZAL,N 13°55'32",W 090°47'10",,2004-05-31 00:00:00,,http://www..puerto-quetzal..com/,,
GTPRQ,,TCQ,TERMINAL DE CONTENEDORES QUETZAL (TCQ),APM TERMINALS,N 13°55'38",W 090°47'28",1582934400000000000,2017-05-23 00:00:00,,https://www..apmterminals..com/en/puerto-quetzal,,APMT acquired TCS in 2015..
GTSTC,,EPSTC,EMPRESA PORTUARIA NACIONAL TERMINAL,EMPRESA PORTURIA NACIONAL,N 15°41'47",W 088°36'58",,2004-05-31 00:00:00,,,,
HKHKG,,ACTHK,ASIA CONTAINER TERMINALS (ACT),ASIA CONTAINER TERMINALS LTD..,N 22°19'29",E 114°07'35",1578009600000000000,2010-10-22 00:00:00,,https://www..hphtrust..com/portfolio_act..html,Terminal 8 West., Container Port Road South., Kwai Chung., Hong Kong,Kwai Tsing Terminal 8 West
HKHKG,,CMC,CHINA MERCHANTS CONTAINER,CHINA MERCHANTS CONTAINER SERVICES LTD..,,,,2015-06-24 00:00:00,,,,
HKHKG,,CKGW,CHU KONG GODOWN,CHU KONG GODOWN WHARF TRANSPORTATION CO..., LTD..,,,,2015-09-21 00:00:00,,,,
HKHKG,,CHTHK,COSCO-HIT (CHT),COSCO-HIT TERMINALS (HONG KONG) LTD..,N 22°19'35",E 114°07'56",1578009600000000000,2010-10-22 00:00:00,,https://www..hphtrust..com/portfolio_cosco..html,Terminal 8 East., Container Port Road South., Kwai Chung., Hong Kong,Kwai Tsing Terminal 8 East
HKHKG,,DPWHK,DP WORLD HONG KONG - CT3,DP WORLD ASIA,N 22°20'32",E 114°07'21",1578009600000000000,2010-10-22 00:00:00,,https://www..dpworld..com/what-we-do/our-locations/Asia-Pacific/China/hong-kong-ct3,,Kwai Tsing Terminal 3
HKHKG,,HITHK,HONG KONG INTERNATIONAL TERMINALS (HIT),HONGKONG INTERNATIONAL TERMINALS LIMITED,N 22°19'56",E 114°07'33",1578009600000000000,2010-10-22 00:00:00,,https://www..hphtrust..com/portfolio_hit..html,Terminal 4., Container Port Road South., Kwai Chung., Hong Kong,Kwai Tsing Terminals 4., 6., 7 and 9 North
HKHKG,,MTLHK,HONG KONG MODERN TERMINALS (MTL),MODERN TERMINALS LIMITED,N 22°20'52",E 114°07'14",1578009600000000000,2010-10-22 00:00:00,,http://www..modernterminals..com/group/index..php/Index/index..html,,Kwai Tsing Terminals 1., 2., 5 and 9 South
HKHKG,,WFC,WEALTH FAIR CONTAINER,WEALTH FAIR CONTAINER SERVICE LTD,,,,2015-06-24 00:00:00,,,,
HNPCR,,ENPCR,EMPRESA NACIONAL PORTUARIA,AGENCIA NAVIERA EUROPEA S..A.. - ANAVE,N 15°50'35",W 087°56'45",,2004-05-31 00:00:00,,,,
HNSLO,,ENPSL,EMPRESA NACIONAL PORTUARIA,PORT OF SAN LORENZO,N 13°24'08",W 087°25'30",,2016-07-28 00:00:00,,,,
HRRJK,,AGCT,ADRIATIC GATE CONTAINER TERMINAL (AGCT),LUKA RIJEKA / INTERNATIONAL CONTAINER TERMINAL SERVICES INC.. (ICTSI),N 45°19'12",E 014°27'15",1578009600000000000,2019-10-04 00:00:00,,,,
HRRJK,,RJKPOR,JADRANSKA VRATA CONTAINER TERMINAL,LUKA RIJEKA,,,1570147200000000000,2015-09-21 00:00:00,1575072000000000000,,,
IDBDJ,,PERUMP,TRISAKTI PORT BANJARMASIN,PELINDO III,S 03°19'39",E 114°33'30",,2018-08-06 00:00:00,,https://www..pelindo..co..id/id/port-terminal/pelabuhan-banjarmasin,Jl.. Barito Hilir Trisakti No.. 6., Banjarmasin 70119., Indonesia,
IDBTM,IDBUR,AMPAR,PORT OF BATU AMPAR,PELINDO I,N 01°09'59",E 104°00'08",1582934400000000000,2015-03-10 00:00:00,,https://www..pelindo1..co..id/cabang/BTM/en/berita/pages/Pelabuhan-Batam..aspx,,
IDJKT,,KADE,TANJUNG PRIOK PORT,CONVENTIONAL TPK,,,,2015-06-12 00:00:00,,,,Berth 208
IDJKT,,T300,TERMINAL MUSTIKA ALAM LESTARI (MAL)., T300,PT MUSTIKA ALAM LESTARI,S 06°05'51",E 106°53'22",1582934400000000000,2015-06-12 00:00:00,,https://dlca..logcluster..org/display/public/DLCA/2..1..1+Indonesia+Jakarta+Port+of+Tanjung+Priok,Jl.. Bitung Ujung No..1., RW..1., Tj.. Priok., Kota Jkt Utara., Jakarta 14310., Indonesia,Berth 300
IDJKT,,UTC1,UNIT PETIKEMAS I,PELINDO II / HUTCHISON PORTS,S 06°05'52",E 106°53'35",1582934400000000000,2015-06-12 00:00:00,,https://www..jict..co..id/,Jl.. Sulawesi Ujung No.. 1., Tanjung Priok., Jakarta 14310., Indonesia,
IDJKT,,UTC3,UNIT PETIKEMAS III,PELINDO II / HUTCHISON PORTS,S 06°06'07",E 106°54'15",1582934400000000000,2015-06-12 00:00:00,,http://www..tpkkoja..co..id,Digul No..1., RW..1., Koja., Kec.. Koja., Kota Jkt Utara., Jakarta 14220., Indonesia,
IDPLM,,BOOMBA,TERMINAL PETIKEMAS PALEMBANG BOOM BARU,PELINDO II,S 02°58'50",E 104°46'43",,2018-08-06 00:00:00,,http://www..palembangport..co..id/,Jalan Belinyu No..1., Boom Baru., Palembang 30115., Indonesia,
IDSUB,,BJTI,BERLIAN JASA TERMINAL INDONESIA (BJTI),PT BERLIAN JASA TERMINAL INDONESIA (BJTI),S 07°12'20",E 112°43'34",1582934400000000000,2015-05-03 00:00:00,,https://www..bjtiport..co..id/b/index..php?option=com_content&view=article&id=237&Itemid=26,Jl.. Prapat Kurung Utara No..60., Perak Utara., Kec.. Pabean Cantian., Surabaya 60165., Indonesia,
IDSUB,,TPS,TERMINAL PETIKEMAS SURABAYA (TPS),PT TERMINAL PETIKEMAS SURABAYA (TPS),S 07°11'52",E 112°42'37",1582934400000000000,2005-09-19 00:00:00,,https://www..tps..co..id/,Jl.. Tanjung Mutiara 1., Surabaya 60177., Indonesia,
IEDUB,,DFP,DUBLIN FERRYPORT TERMINAL,DUBLIN FERRYPORT,N 53°20'48",W 006°12'01",1579824000000000000,2015-06-12 00:00:00,,https://www..icg..ie/our-businesses/container-terminal/dublin-ferryport-terminals/,Ferryport., Alexandra Road., Dublin 1., Ireland,Berths 50.,50A
IEDUB,,MTL,MARINE TERMINALS LTD,PEEL PORTS GROUP,N 53°20'36",W 006°12'38",1579824000000000000,2015-06-12 00:00:00,,https://www..peelports..com/ports/dublin,South Bank Quay Container Terminal., Pigeon House Road., Ringsend., Dublin 4., Ireland,Berths 41.,42.,43.,44.,45
IEDUB,,POEURO,P&O EUROPEAN FERRIES TERMINAL,P&O EUROPEAN FERRIES,N 53°20'45",W 006°13'13",1582934400000000000,2015-06-12 00:00:00,,,Terminal 3., North Quay Extension., Dublin 1., Ireland,Berth 21 (RORO terminal)
IEDUB,,PORTRO,PORTROE TERMINAL,DUBLIN PORT,N 53°20'55",W 006°12'57",,2015-06-12 00:00:00,,,Alexandra Quay., Alexandra Road., Dublin 1., Ireland,Berth 30
IEORK,,RDT,RINGASDKIDDY DEEPWATER TERMINAL,PORT OF CORK,N 51°50'02",W 008°19'43",,2019-07-05 00:00:00,,https://www..portofcork..ie,Custom House., Custom House Street., Port of Cork Company., Ireland,
IEORK,,TIVO,TIVOLI TERMINAL,PORT OF CORK,N 51°54'01",W 008°24'57",,2015-06-12 00:00:00,,https://www..portofcork..ie,Custom House., Custom House Street., Port of Cork Company., Ireland,
ILASH,,APCL,ASHDOD PORT CO..., LTD..,ASHDOD PORT CO..., LTD..,N 31°50'04",E 034°38'52",,2004-05-31 00:00:00,,,,
ILHFA,,HPCL,HAIFA PORT CO..., LTD..,HAIFA PORT CO..., LTD..,N 32°49'02",E 035°00'38",,2004-05-31 00:00:00,,,,
INCCU,,CALCUT,KOLKATA DOCK SYSTEM (KDS),KOLKATA PORT TRUST,N 22°32'24",E 088°18'01",,2015-06-12 00:00:00,,http://www..kolkataporttrust..gov..in/,,
INCOK,,ICCT,ICTT VALLARPADAM,INDIA GATEWAY TERMINAL PVT.. LTD.. / DP WORLD,N 09°58'41",E 076°15'08",1578009600000000000,2015-03-25 00:00:00,1580428800000000000,http://igtpl..com/,,
INCOK,,ICTT,KOCHI INTERNATIONAL CONTAINER TRANSSHIPMENT TERMINAL (ICTT),INDIA GATEWAY TERMINAL PVT.. LTD.. / DP WORLD,N 09°58'41",E 076°15'08",,2020-02-01 00:00:00,,http://igtpl..com/,,Locally known as VALLARPADAM TERMINAL
INENR,,AECTPL,ADANI ENNORE CONTAINER TERMINAL,ADANI INTERNATIONAL CONTAINER TERMINAL PVT.. LTD..,N 13°16'19",E 080°20'16",1578009600000000000,2019-07-05 00:00:00,,https://www..adaniports..com,,
INIXE,,NMPT,NEW MANGALORE PORT,NEW MANGALORE PORT TRUST,N 12°56'00",E 074°49'06",1578009600000000000,2015-06-24 00:00:00,,http://newmangaloreport..gov..in:8080/#!/,,
INMAA,,CCTL,CHENNAI CONTAINER TERMINAL (CCTL),CHENNAI CONTAINER TERMINAL PVT.. LTD.. / DP WORLD,N 13°06'21",E 080°17'55",1578009600000000000,2005-09-19 00:00:00,,http://www..dpworldchennai..com/,,
INMAA,,CITPL,CHENNAI INTERNATIONAL CONTAINER TERMINAL (CITPL),CHENNAI INTERNATIONAL CONTAINER TERMINALS PVT LTD / PSA,N 13°05'38",E 080°18'06",1578009600000000000,2015-06-20 00:00:00,,https://www..citpl..co..in/terminal-layout/,,
INMUN,,ACMTPL,ADANI CMA MUNDRA CONTAINER TERMINAL (ACMTPL),ADANI CMA MUNDRA CONTAINER TERMINAL PVT.. LTD.. (ACMTPL) / CMA-CGM,N 22°44'20",E 069°41'09",1585699200000000000,2020-04-01 00:00:00,,https://www..adaniports..com/,ACMTPL., Adani Ports & SEZ Ltd.. Mundra., Kutch., Gujarat., India.. 370421,CT4 (South Basin)., berths CB4/CB5
INMUN,,AICTPL,ADANI INTERNATIONAL CONTAINER TERMINAL (AICTPL),ADANI INTERNATIONAL CONTAINER TERMINAL PVT.. LTD.. (AICTPL) / MSC,N 22°44'20",E 069°41'46",1585699200000000000,2015-06-12 00:00:00,,https://www..adaniports..com/,AICTPL., Adani Ports & SEZ Ltd.. Mundra., Kutch., Gujarat., India.. 370421,CT3 (South Basin)., berths CB6/CB7/CB8/CB9
INMUN,,AMCT,ADANI MUNDRA CONTAINER TERMINAL (AMCT),ADANI MUNDRA CONTAINER TERMINAL PVT.. LTD.. (AMCT),N 22°44'46",E 069°42'29",1585699200000000000,2020-04-01 00:00:00,,https://www..adaniports..com/,AMCT., Adani Ports & SEZ Ltd.. Mundra., Kutch., Gujarat., India.. 370421,CT2., berths CB3/CB4
INMUN,,MICT,MUNDRA INTERNATIONAL CONTAINER TERMINAL (MICT),MUNDRA INTERNATIONAL CONTAINER TERMINAL PVT.. LTD.. / DP WORLD,N 22°44'36",E 069°42'44",1585699200000000000,2005-09-19 00:00:00,,http://www..dpworldmundra..com/,,CT1., berths CB1/CB2
INMUN,,MPSEZ,MUNDRA PORT,MUNDRA PORT & SPECIAL ECONOMIC ZONE,,,1585699200000000000,2015-06-12 00:00:00,1593475200000000000,,,Phasing out.. Replaced by ADANI MUNDRA CONTAINER TERMINAL (AMCT)
INNSA,,BMCT,BHARAT MUMBAI CONTAINER TERMINALS,BHARAT MUMBAI CONTAINER TERMINALS PVT.. LTD.. (PSA),N 18°56'00",E 072°56'00",,2018-09-17 00:00:00,,,,
INNSA,,GTICI,GATEWAY TERMINALS INDIA (GTI),GATEWAY INDIA TERMINALS PVT.. LTD.. (APM / CONCOR),N 18°56'54",E 072°56'29",,2019-04-16 00:00:00,,https://www..apmtmumbai..com,APM Terminals Mumbai., Gateway Terminals India Pvt.. Ltd..., GTI House., JNPT., Sheva., Navi Mumbai 400707., India,APM Terminals Mumbai
INNSA,,JNPCT,JAWAHARLAL NEHRU PORT CONTAINER TERMINAL (JNPCT),JAWAHARLAL NEHRU PORT TRUST (JNP),N 18°56'43",E 072°56'24",1442793600000000000,2014-10-27 00:00:00,,,,
INNSA,,NSIGT,NHAVA SHEVA (INDIA) GATEWAY TERMINAL (NSIGT),NHAVA SHEVA (INDIA) GATEWAY TERMINAL PVT.. LTD.. (DP WORLD),N 18°57'47",E 072°57'02",,2019-04-16 00:00:00,,http://www..dpworldnhavashevaigt..com,NSIGT., Operation Centre., Near JNPT., Sheva., Navi Mumbai 400707., India,
INNSA,,NSICT,NHAVA SHEVA INTERNATIONAL CONTAINER TERMINAL (NSICT),NHAVA SHEVA INTERNATIONAL CONTAINER TERMINAL PVT.. LTD.. (DP WORLD),N 18°57'30",E 072°56'54",,2019-04-16 00:00:00,,http://www..dpworldmumbai..com,NSICT., Operation Centre., Near JNPT., Sheva., Navi Mumbai 400707., India,
INPAV,,GPPL,GUJARAT PIPAVAV PORT LIMITED,GUJARAT PIPAVAV PORT LIMITED,N 20°55'10",E 071°30'38",1547337600000000000,2004-05-31 00:00:00,1561852800000000000,,,
INPPV,INPAV,APMT,APM TERMINALS PIPAVAV,APM TERMINALS (GUJARAT PIPAVAV PORT LTD..),N 20°55'13",E 071°30'39",,2019-01-17 00:00:00,,https://www..apmterminals..com/en/operations/asia-pacific/pipavav/about-us/location,,
INTUT,,DBGT,DAKSHIN BHARAT GATEWAY TERMINAL,DAKSHIN BHARAT GATEWAY TERMINAL PVT.. LTD..,N 08°45'07",E 078°12'47",1578009600000000000,2015-06-12 00:00:00,,https://www..vocport..gov..in/,Berth No 8., V..O..C Port Trust., Tuticorin Container Terminal Rd., Harbour Estate., Tuticorin 628004., India,
INTUT,,PSASIC,PSA SICAL TERMINAL,PSA SICAL TERMINAL LTD..,N 08°44'57",E 078°12'59",1578009600000000000,2015-06-12 00:00:00,,https://psasical..co..in/index..html,Berth No 7., Harbour Estate., Tuticorin 628004., India,
INVTZ,,VCT,VISAKHA CONTAINER TERMINAL,VISAKHA CONTAINER TERMINAL PVT.. LTD..,N 17°41'39",E 083°18'00",,2018-12-18 00:00:00,,https://www..vctpl..com,,
IQUQR,,BGT,BASRA GATEWAY TERMINAL,INTERNATIONAL CONTAINER TERMINAL SERVICES., INC.. (ICTSI),N 30°03'54",E 047°55'42",,2018-05-25 00:00:00,,http://www..ictsiiraq..com/default..aspx,,
ISREY,,SUNDA,KLEPPSBAKKI,FAXAPORTS,N 64°09'01",W 021°51'15",,2018-09-24 00:00:00,,https://faxaports..is/,,
