UNLOCODE,Alternative UNLOCODEs,Terminal Code,Terminal Facility Name,Terminal Company Name,Latitude (DMS),Longitude (DMS),Last change,Valid from,Valid until,Terminal Website,Terminal Address,Remarks
JPTYO,,OHM,OHI CONTAINER TERMINAL BERTH NO.. 3/4,MITSUI O..S..K.. LINES., LTD.. (UTOC / TICT),N 35°36'21",E 139°45'55",1579824000000000000,2015-05-11 00:00:00,,http://www..tptc..co..jp/en/guide/oi/about,,
JPTYO,,OHA,OHI CONTAINER TERMINAL BERTH NO.. 5,WAN HAI LINES..LTD.. (AZUMA SHIPPING CO..., LTD..),N 35°36'07",E 139°46'05",1579824000000000000,2015-05-11 00:00:00,,http://www..tptc..co..jp/en/guide/oi/about,,
JPTYO,,OHN,OHI CONTAINER TERMINAL BERTH NO.. 6/7,NIPPON YUSEN KAISHA LTD.. / UNIX CORP..,N 35°35'53",E 139°46'16",1579824000000000000,2015-05-11 00:00:00,,http://www..tptc..co..jp/en/guide/oi/about,,
JPTYO,,SHG,SHINAGAWA CONTAINER TERMINAL,DAIICHI / SUMITOMO / NIPPON EXPRESS / SANKYU / AZUMA SHIPPING,N 35°37'45",E 139°45'33",1579824000000000000,2015-05-08 00:00:00,,http://www..tptc..co..jp/en/guide/shinagawa/about,,Berths SC/SD/SE/SF
JPUBJ,,SF01C,SHIBANAKA BERTH NO.. 1,SHIBANAKA NO.. 1 BERTH,N 33°56'14",E 131°14'15",1574208000000000000,2001-06-26 00:00:00,,,,
JPUBJ,,SF04C,SHIBANAKA WEST (SHIBANAKANISI) BERTH NO.. 1,SHIBANAKA WEST BERTH,N 33°55'58",E 131°14'00",1578009600000000000,2001-06-26 00:00:00,1580428800000000000,,,
JPUBJ,,SWW,SHIBANAKA WEST WHARF (SHIBANAKANISI),SHIBANAKA WEST WHARF (SHIBANAKANISI),N 33°55'58",E 131°14'00",,2020-01-01 00:00:00,,,,
JPUKB,,KCT,KOBE CONTAINER TERMINAL PC-18 / KAMIGUMI,KOBE CONTAINER TERMINAL PC-18 / KAMIGUMI,N 34°40'00",E 135°14'05",,2004-05-31 00:00:00,,,,
JPUKB,,PIM,PORT ISLAND M BERTH,PORT ISLAND M BERTH (IMOTO LINES),N 34°39'07",E 135°14'37",,2019-10-04 00:00:00,,,,
JPUKB,,PC13,PORT ISLAND PC-13,APL / SUMITOMO WAREHOUSE,N 34°39'30",E 135°13'48",1578009600000000000,2015-06-20 00:00:00,,,https://hanshinport..co..jp/en/facilities/,
JPUKB,,PC14,PORT ISLAND PC-14,NISSIN CORPORATION,N 34°39'34",E 135°14'01",1578009600000000000,2015-06-20 00:00:00,,,https://hanshinport..co..jp/en/facilities/,
JPUKB,,PC15,PORT ISLAND PC-15,SUMITOMO WAREHOUSE / SANKYU INC.. / NICKEL & LYONS., LTD..,N 34°39'38",E 135°14'19",1578009600000000000,2015-06-20 00:00:00,,,https://hanshinport..co..jp/en/facilities/,
JPUKB,,PC16,PORT ISLAND PC-16/17,MITSUI O..S..K.. LINES., LTD / SANKYU INC.. / SUMITOMO WAREHOUSE / NICKEL & LYONS., LTD..,N 34°39'20",E 135°14'31",1578009600000000000,2015-06-20 00:00:00,,,https://hanshinport..co..jp/en/facilities/,
JPUKB,,RC3,ROKKO ISLAND RC-3,KAWASAKI KISEN KAISHA LTD../APM TERMINALS JAPAN,,,1570147200000000000,2015-06-30 00:00:00,1568332800000000000,,,
JPUKB,,RC4,ROKKO ISLAND RC-4,KAWASAKI KISEN KAISHA LTD.. / APM TERMINALS JAPAN CO..., LTD.. / KAMIGUMI CO..., LTD..,N 34°40'43",E 135°15'31",1578009600000000000,2015-06-30 00:00:00,,,https://hanshinport..co..jp/en/facilities/,
JPUKB,,RC5,ROKKO ISLAND RC-5,KAWASAKI KISEN KAISHA LTD.. / APM TERMINALS JAPAN CO..., LTD.. / KAMIGUMI CO..., LTD..,N 34°40'45",E 135°15'50",1578009600000000000,2015-06-30 00:00:00,,,https://hanshinport..co..jp/en/facilities/,
JPUKB,,RC6,ROKKO ISLAND RC-6/7,NIPPON YUSEN KABUSHIKI KAISHA,N 34°40'53",E 135°17'05",1578009600000000000,2015-06-30 00:00:00,,,https://hanshinport..co..jp/en/facilities/,
JPUKB,,RWX,ROKKO ISLAND RWX,ROKKO ISLAND RWX (MITSUBISHI LOGISTICS),N 34°41'21",E 135°16'50",,2019-10-04 00:00:00,,,,
JPUKB,,RSB,ROKKO ISLAND SOUTH B BERTH,ROKKO ISLAND SOUTH B BERTH (IMOTO LINES),N 34°40'50",E 135°16'41",1570492800000000000,2019-09-13 00:00:00,1570492800000000000,,,
JPUKB,,RSBC,ROKKO ISLAND SOUTH B/C BERTH,IMOTO LINES,N 34°40'50",E 135°16'41",,2019-10-18 00:00:00,,,,
JPWKJ,,SE01C,SUEHIRO PIER EAST,SUEHIRO PIER EAST,N 45°24'15",E 141°41'28",1582934400000000000,2001-06-26 00:00:00,,http://www..mlit..go..jp/common/001181872..pdf,,
JPYKK,,KSN,KASUMIGAURA NORTH PIER., W80,JAPAN TRANSCITY CORPORATION,N 34°59'50",E 136°40'07",1582934400000000000,2015-06-16 00:00:00,,http://www..yokkaichi-port..or..jp/b_container_terminai..html,,
JPYKK,,KSS,KASUMIGAURA SOUTH PIER., W26/W27,JAPAN TRANSCITY CORPORATION,N 34°59'32",E 136°39'51",1582934400000000000,2015-06-16 00:00:00,,http://www..yokkaichi-port..or..jp/b_container_terminai..html,,
JPYOK,,APMYOK,APM TERMINALS YOKOHAMA,APM TERMINALS,N 35°24'08",E 139°40'45",1579046400000000000,2016-09-01 00:00:00,,https://www..apmterminals..com/en/operations/asia-pacific/yokohama/about-us,,APMT operates at MINAMI-HONMOKU CONTAINER TERMINAL MC-1&2
JPYOK,,DC3,DAIKOKU CONTAINER TERMINAL C-3,NIPPON EXPRESS / KAMIGUMI CO..., LTD..,N 35°27'33",E 139°41'36",1579046400000000000,2015-06-20 00:00:00,,http://www..yokohamaport..co..jp..e..df..hp..transer..com/facilities/daikoku/,,
JPYOK,,DC4,DAIKOKU CONTAINER TERMINAL C-4,NIPPON YUSEN KABUSHIKI KAISHA,N 35°27'38",E 139°41'47",1579046400000000000,2015-06-20 00:00:00,,http://www..yokohamaport..co..jp..e..df..hp..transer..com/facilities/daikoku/,,
JPYOK,,DT9,DAIKOKU CONTAINER TERMINAL T-9,MITSUI SOKO CO..., LTD.. / SUMITOTO WAREHOUSE,N 35°27'28",E 139°41'25",1585699200000000000,2015-06-20 00:00:00,,http://www..yokohamaport..co..jp..e..df..hp..transer..com/facilities/daikoku/,Daikoku T9 Container Terminal., 25 Daikokufuto., Tsurumi-Ku., Yokohama., Kanagawa., Japan,
JPYOK,,HA5,HONMOKU CONTAINER TERMINAL A-5..6,KAWASAKI KISEN KAISHA., LTD..,N 35°26'49",E 139°40'21",1579824000000000000,2015-06-30 00:00:00,,http://www..yokohamaport..co..jp..e..df..hp..transer..com/facilities/honmoku/,,
JPYOK,,HA6,HONMOKU CONTAINER TERMINAL A-6..7,KAWASAKI KISEN KAISHA., LTD.. / NISSIN CORPORATION / KEIHIN KOUN CO..LTD..,N 35°26'40",E 139°40'15",1579824000000000000,2015-06-30 00:00:00,,http://www..yokohamaport..co..jp..e..df..hp..transer..com/facilities/honmoku/,,
JPYOK,,HBC,HONMOKU CONTAINER TERMINAL BC,YOKOHAMA PORT MEGATERMINAL CO..., LTD..,N 35°26'15",E 139°40'43",1579824000000000000,2015-06-30 00:00:00,,http://www..yokohamaport..co..jp..e..df..hp..transer..com/facilities/honmoku/,,
JPYOK,,HD1,HONMOKU CONTAINER TERMINAL D-1,YOKOHAMA PORT MEGATERMINAL CO..., LTD..,N 35°26'03",E 139°40'51",1579824000000000000,2015-06-30 00:00:00,,http://www..yokohamaport..co..jp..e..df..hp..transer..com/facilities/honmoku/,,
JPYOK,,HD4,HONMOKU CONTAINER TERMINAL D-4,AMERICAN PRESIDENT LINES., LTD..,N 35°26'16",E 139°40'59",1579824000000000000,2015-06-30 00:00:00,,http://www..yokohamaport..co..jp..e..df..hp..transer..com/facilities/honmoku/,,
JPYOK,,HD5,HONMOKU CONTAINER TERMINAL D-5,MITSUI O..S..K.. LINES., LTD..,N 35°26'26",E 139°41'05",1579824000000000000,2015-06-30 00:00:00,,http://www..yokohamaport..co..jp..e..df..hp..transer..com/facilities/honmoku/,,
JPYOK,,MHM,MINAMI-HONMOKU CONTAINER TERMINAL MC-3,MITSUBISHI LOGISTICS CO..., LTD..,N 35°24'01",E 139°41'02",1579824000000000000,2015-06-20 00:00:00,,http://www..yokohamaport..co..jp..e..df..hp..transer..com/facilities/minamihonmoku/,,
KEMBA,,MCT,KENYA PORT AUTHORITY TERMINAL,KENYAN PORT AUTHORITY - KPA,S 04°02'45",E 039°37'37",,2018-05-04 00:00:00,,https://www..kpa..co..ke/OurBusiness/Pages/Container-Terminal-Operations..aspx,,
KHKOS,,SPA,SIHANOUKVILLE PORT,SIHANOUKVILLE PORT AUTHORITY,N 10°38'52",E 103°30'38",1579824000000000000,2015-06-24 00:00:00,,http://www..pas..gov..kh/en,,
KRINC,,E1CTC,E1 CONTAINER TERMINAL,E1 CONTAINER TERMINAL,N 37°26'23",E 126°36'39",1579824000000000000,2018-12-18 00:00:00,,http://www..e1ct..co..kr/homepage/Eng/center_eng..asp,,See also https://www..icpa..or..kr/eng/content/view..do?menuKey=637&contentKey=145
KRINC,,HJITC,HANJIN INCHEON CONTAINER TERMINAL (HJIT),HANJIN INCHEON CONTAINER TERMINAL,N 37°20'32",E 126°37'38",1579824000000000000,2019-01-17 00:00:00,,http://www..hjit..co..kr/eng/Main..do,,See also https://www..icpa..or..kr/eng/content/view..do?menuKey=637&contentKey=146
KRINC,,ICTPC,INCHEON CONTAINER TERMINAL (ICT),INCHEON CONTAINER TERMINALS CO..., LTD.. / PSA,N 37°26'19",E 126°35'52",1579824000000000000,2018-12-18 00:00:00,,https://www..psa-ict..co..kr/eng/main/main..psa,,See also https://www..icpa..or..kr/eng/content/view..do?menuKey=637&contentKey=147
KRINC,,SNCTC,SUNKWANG NEWPORT CONTAINER TERMINAL (SNCT),SUNKWANG NEWPORT CONTAINER TERMINAL CO..., LTD..,N 37°20'32",E 126°38'11",1579824000000000000,2018-12-18 00:00:00,,http://snct..sun-kwang..co..kr/eng/page/terminal05..jsp,,See also https://www..icpa..or..kr/eng/content/view..do?menuKey=637&contentKey=148
KRKAN,,GWCT,GWANGYANG WEST CONTAINER TERMINAL,GWANGYANG WEST CONTAINER TERMINAL CO..., LTD..,N 34°53'47",E 127°39'19",,2018-12-18 00:00:00,,https://www..cjlogistics..com,1392., Hwang Gil Dong., Gwang Yang., Chonnam., South Korea,
KRKAN,,KIT,KOREA INTERNATIONAL CONTAINER TERMINAL,KOREA INTERNATIONAL TERMINAL,N 34°54'09",E 127°39'59",,2015-05-03 00:00:00,,https://www..kitl..com/eng/index..kitl,240., Keonbudu-ro., Gwangyang-si., Jeollanam-do., South Korea,
KRKAN,,GIGCT,SM GWANGYANG TERMINAL,SM LINE GWANGYANG TERMINAL CO..., LTD..,N 34°54'34",E 127°40'38",,2018-12-18 00:00:00,,http://home..smlgt..co..kr/home,390., Keonbudu-ro., Gwangyang-si., Jeollanam-do., South Korea,
KRKPO,,PICTC,POHANG INTERNATIONAL CONTAINER TERMINAL (PICT),POHANG YEONGILMAN SHINHANG PORT CO..,N 36°06'20",E 129°26'21",1579824000000000000,2018-12-18 00:00:00,,http://www..pohangport..com/eng/main..html,,
KRPTK,,PCTCC,PYEONGTAEK CONTAINER TERMINAL,PYEONGTAEK CONTAINER TERMINAL CO,N 36°57'53",E 126°50'21",,2018-12-18 00:00:00,,http://www..pctc21..com/eng,,
KRPTK,,PNCTC,PYEONGTAEK DONGBANG I-PORT,PYEONGTAEK DONGBANG I-PORT CO..., LTD..,N 36°57'02",E 126°51'03",,2018-12-18 00:00:00,,http://www..pnct..co..kr/homepage/eng/page/com_directions..jsp,Dongnam Building 2F., 7-10., UnJeong-ri., HyunDeok-myun., Pyeongtaek-si., GyeongGi-do., South Korea,
KRPUS,,BNCT,BUSAN NEW CONTAINER TERMINAL (BNCT),BUSAN NEW CONTAINER TERMINAL CO..., LTD..,N 35°04'04",E 128°48'46",1579824000000000000,2015-03-06 00:00:00,,http://www..bnctkorea..com/,586., Sinhangnam-ro., (Seongbuk-dong)., Gangseo-gu., Busan., South Korea,New Port Pier 5
KRPUS,,KBCT,BUSAN PORT TERMINAL (BPT),BUSAN PORT TERMINAL,N 35°06'20",E 129°05'42",1515801600000000000,2004-05-31 00:00:00,,http://info..bptc..co..kr/,,Sinseondae pier and Gamman pier
KRPUS,,DPCT,DONGBU PUSAN CONTAINER TERMINAL (DPCT),DONGBU PUSAN CONTAINER TERMINAL CO..., LTD..,N 35°06'22",E 129°04'16",1579824000000000000,2004-05-31 00:00:00,,http://www..dpct..co..kr/,,Sin-gamman Pier
KRPUS,KRBNP,HJNC,HANJIN BUSAN NEW PORT CO.. (HJNC),HANJIN BUSAN NEW PORT CO..,N 35°04'40",E 128°47'28",1579824000000000000,2015-03-06 00:00:00,,http://www..hjnc..co..kr/ENG/intro..aspx,,New Port Pier 3
KRPUS,,HBCT,HUTCHISON BUSAN CONTAINER TERMINAL (HBCT),HUTCHISON PORTS BUSAN,N 35°07'22",E 129°03'37",1579824000000000000,2015-03-25 00:00:00,,https://www..hktl..com/main/main..php,314., Chungjang-daero., Dong-gu., Busan., South Korea,Jaseongdae pier
KRPUS,,HPNT,PSA HYUNDAI PUSAN NEW-PORT TERMINAL (HPNT),PSA HYUNDAI PUSAN NEW-PORT TERMINAL CO..,N 35°04'12",E 128°49'35",1579824000000000000,2015-03-06 00:00:00,,https://www..hpnt..co..kr/homepage/eng/webpage/,,New Port Pier 4
KRPUS,,PNC,PUSAN NEW PORT CO.. (PNC),PUSAN NEW PORT CO..,N 35°04'40",E 128°48'27",1582934400000000000,2004-05-31 00:00:00,,https://pncport..com/eng/,,New Port Pier 2
KRPUS,,PNP,PUSAN NEW PORT INTERNATIONAL TERMINAL (PNIT),PUSAN NEW PORT INTERNATIONAL TERMINAL CO..,N 35°04'40",E 128°49'31",1582934400000000000,2004-05-31 00:00:00,,https://www..pnitl..com/infoservice/main/mainPage..jsp,,New Port Pier 1
KRUSN,,JUCTC,JEONG IL ULSAN CONTAINER TERMINAL,JEONG IL ULSAN CONTAINER TERMINAL CO..., LTD,N 35°26'32",E 129°21'10",,2018-12-18 00:00:00,,https://www..juct..co..kr/,150-5 Sanam-ri., Onsan-eup., Ulju-gun., Ulsan., South Korea,
KRUSN,,UDITC,ULSAN NEWPORT CONTAINER TERMINAL (UNCT),ULSAN NEWPORT CONTAINER TERMINAL CO..., LTD,N 35°27'20",E 129°21'55",1579824000000000000,2018-12-18 00:00:00,,http://www..unct..co..kr/,625-1 Hwangseong-dong., Nam-gu., Ulsan., South Korea,
KWSAA,,SAACT,SHUAIBA CONTAINER TERMINAL,GLOBAL CLEARINGHOUSE SYSTEMS COMPANY,N 29°02'45",E 048°09'17",,2020-06-08 00:00:00,,https://www..gcskw..com/,Shuaiba Container Terminal., berths no.. 15.,16.,17.,18.. Eastern Road., Kuwait,Berths 15.,16.,17.,18
KWSWK,,SWKCT,SHUWAIKH CONTAINER TERMINAL,JASSIM TRANSPORT & STEVEDORING COMPANY,N 29°20'56",E 047°55'15",,2020-06-08 00:00:00,,http://www..jtckw..com/,Shuwaikh Container Terminal., berths No.. 10 & 13,Berths 10.,12.,13
LBBEY,,BCTC,BEIRUT CONTAINER TERMINAL CONSORTIUM SAL,BEIRUT CONTAINER TERMINAL CONSORTIUMSAL - BCTC,N 33°54'32",E 035°32'03",,2004-05-31 00:00:00,,,,
LKCMB,,CICT,COLOMBO INTERNATIONAL CONTAINER TERMINAL,COLOMBO INTERNATIONAL CONTAINER TERMINALS LTD..,N 06°56'44",E 079°49'58",1579824000000000000,2015-06-20 00:00:00,,http://www..cict..lk/,,
LKCMB,,LKJCT,JAYA CONTAINER TERMINAL,JAYA CONTAINER TERMINAL,N 06°56'52",E 079°51'10",1579824000000000000,2005-09-19 00:00:00,,http://portcom..slpa..lk/Jaya_container_terminal..asp?chk=6,,
LKCMB,,LKSGT,S/ASIA GATEWAY TERMINAL,S/ASIA GATEWAY TERMINAL,,,1579824000000000000,2005-09-19 00:00:00,1580428800000000000,https://www..sagt..com..lk/,,
LKCMB,,SAGT,SOUTH ASIA GATEWAY TERMINAL,SOUTH ASIA GATEWAY TERMINAL,N 06°56'48",E 079°50'44",1579824000000000000,2005-09-19 00:00:00,,https://www..sagt..com..lk/,,
LKCMB,,LKUCT,UNITY CONTAINER TERMINAL,UNITY CONTAINER TERMINAL,N 06°57'30",E 079°51'18",1579824000000000000,2005-09-19 00:00:00,,http://portcom..slpa..lk/unity_container_terminal..asp?chk=6,,
LTKLJ,,KLAB,KLA-BULK,KLA-BULK,,,1413763200000000000,2005-02-23 00:00:00,1596153600000000000,,,Delete.. Unable to confirm the existence and location of the terminal..
LTKLJ,,KKT,KLAIPEDA CONTAINER TERMINAL,KLAIPEDOS KONTEINERIU TERMINALAS,N 55°38'45",E 021°09'36",1593561600000000000,2014-11-10 00:00:00,,https://www..terminalas..lt/?lang=en,Minijos st.. 180., LT-93269 Klaipeda., Lithuania,Berths 143.,143a
LTKLJ,,KAS,KLAIPEDOS SMELTE CONTAINER TERMINAL (KSCT),KLAIPEDOS SMELTE,N 55°40'40",E 021°08'34",1593561600000000000,2014-11-10 00:00:00,,http://www..smelte..lt/index..php/en/,Nemuno str.. 24., LT-93278 Klaipeda., Lithuania,Berths 82-96
LTKLJ,,KLAK,KLA-KLASCO,KLA-KLASCO,,,,2005-02-23 00:00:00,1596153600000000000,,,Delete.. Does not handle containerized cargo..
LTKLJ,,KLAT,KLA-TERMINALAS,KLA-TERMINALAS,,,,2005-02-23 00:00:00,1596153600000000000,,,Delete.. Unable to confirm the existence and location of the terminal..
LVRIX,,BCT,BALTIC CONTAINER TERMINAL RIGA,BALTIC CONTAINER TERMINAL,N 57°00'26",E 024°05'48",1582934400000000000,2007-11-10 00:00:00,,http://www..bct..lv/,,
LVRIX,,RCT,RIGA CONTAINER TERMINAL (RIGACT),RIGA CONTAINER TERMINAL (RIGACT),N 56°58'51",E 024°05'37",1582934400000000000,2008-01-16 00:00:00,,https://www..rto..lv/en/services/terminal-operations/riga-container-terminal/,,
LVRIX,,RUT,RIGA UNIVERSAL TERMINAL,RIGA UNIVERSAL TERMINAL,N 57°02'31",E 024°04'34",1582934400000000000,2014-11-12 00:00:00,,http://www..ruterminal..lv/,,
MACAS,,EST,CONTAINER TERMINAL EST,MARSA MAROC,N 33°36'36",W 007°35'46",1582934400000000000,2005-10-07 00:00:00,,http://www..marsamaroc..co..ma/en/espace-corporate/casablanca,,
MACAS,,SODEP,SODEP,SOCIETE D'EXPLOITATION DES PORTS,,,1588291200000000000,2015-06-12 00:00:00,1590883200000000000,,,Delete.. Duplicate., identical to Container Terminal EST (Terminal à conteneurs EST)..
MACAS,,SOMAP,SOMAPORT,SOMAPORT,N 33°36'17",W 007°36'15",1582934400000000000,2015-06-12 00:00:00,,https://www..somaport..ma/en/design-terminal-tp,,
MACAS,,OLP,TERMINAL WEST (OLD PORT),PORT DE CASABLANCA,,,1588291200000000000,2005-10-07 00:00:00,1590883200000000000,,,Delete.. Not for containerized or RoRo cargo..
MAPTM,,APM2,APM TERMINALS TANGIER MEDPORT 2,APM TERMINALS TANGIER,N 35°51'47",W 005°32'18",,2019-08-22 00:00:00,,https://www..apmterminals..com/en/medport-tangier,Port de Tanger Med., Ksar es Seghir., Morocco,CT4
MAPTM,,EURTN,EUROGATE TANGIER,EUROGATE TANGIER S..A,N 35°53'39",W 005°29'21",1576195200000000000,2004-05-31 00:00:00,,http://www1..eurogate..de/en/Terminals/Tangier,Zone Franche de Ksar Al Majaz., Ouad R'mel., Commune Anjra., Route Fnideq., 90000 Tangier., Morocco,CT2
MAPTM,,APMT,PORT TANGIER MEDITERRANEE,APM TERMINALS TANGIER,N 35°53'19",W 005°29'29",,2018-02-19 00:00:00,,,,CT1
MAPTM,,TAT,TANGER ALLIANCE TERMINAL,TANGER ALLIANCE (MARSA MAROC., EUROGATE),N 35°52'32",W 005°31'32",,2020 t..b..a..,,,,CT3
MATNG,,PDC,MOLLE DE COMMERCE CONTAINER TERMINAL,TANGER PORT,,,1588291200000000000,2005-10-07 00:00:00,1590883200000000000,,,Delete.. No longer a cargo terminal..
MMRGN,,AIPT1,AHLONE INTERNATIONAL PORT TERMINAL 1,MYANMAR PORT AUTHORITY,N 16°47'07",E 096°07'10",,2019-12-13 00:00:00,,https://www..aipt1..com,Ahlone Road., Ahlone Township., Yangon., Myanmar,
MMRGN,,AWPT,ASIA WORLD PORT TERMINAL,ASIA WORLD PORT MANAGEMENT CO.. LTD..,N 16°47'34",E 096°07'12",,2019-12-13 00:00:00,,https://www..asiaworldcompany..com,No.. (61-62)., Bahosi Development., Wadan Street., Lanmadaw Township., Yangon., Myanmar,
MMRGN,,BAKT,BO AUNG KYAW TERMINAL,LANN PYI MARINE CO.. LTD,N 16°46'00",E 096°09'57",,2019-12-13 00:00:00,,http://lpm-myanmar..com,No.. 55/61., Strand Road., Seikkan Township., Yangon., Myanmar,
MMRGN,,MIP,MYANMAR INDUSTRIAL PORT (MIP),MYANMAR INDUSTRIAL PORT (MIP) CONTAINER TERMINAL ,N 16°46'34",E 096°07'56",,2019-11-18 00:00:00,,https://www..myanmarindustrialport..com/index,No.. 7/2 (B) Strand Road., Ahlone Township., Yangon., Myanmar..,
MMRGN,,MITT,MYANMAR INTERNATIONAL TERMINALS THILAWA (HUTCHISON MITT),MYANMAR INTERNATIONAL TERMINALS THILAWA LTD..,N 16°39'59",E 096°15'01",,2019-12-13 00:00:00,,https://www..mitt..com..mm,Thilawa., Kyauktan Township., Yangon., Myanmar,Subsidiary company of CK Hutchison Holdings., Hong Kong
MRNKC,,APMT,APM TERMINALS NOUAKCHOTT,APM TERMINALS,,,,2019-02-15 00:00:00,1593475200000000000,,,Delete.. APMT and OPM operate in Nouakchott., but there is only one terminal (Friendship Port)..
MRNKC,,PANPA,FRIENDSHIP PORT OF NOUAKCHOTT,PORT AUTONOME DE NOUAKCHOTT - PORT DE L'AMITIE (PANPA),N 17°59'27",W 016°02'05",,2020-06-08 00:00:00,,,,
MRNKC,,OPM,OPÉRATIONS PORTUAIRES MAURITANIENNES (OPM),OPÉRATIONS PORTUAIRES MAURITANIENNES SA (OPM),,,,2019-02-15 00:00:00,1593475200000000000,,,Delete.. APMT and OPM operate in Nouakchott., but there is only one terminal (Friendship Port)..
MTMAR,,FREE,MALTA FREEPORT TERMINALS LTD,MALTA FREEPORT TERMINALS LTD..,N 35°49'12",E 014°32'34",,2004-05-31 00:00:00,,,,
MXATM,,ATP,ALTAMIRA TERMINAL PORTUARIA,ALTAMIRA TERMINAL PORTUARIA SA DE CV,N 22°28'37",W 097°53'06",,2004-05-31 00:00:00,,,,
MXATM,,IPM,INFRAESTRUCTURA PORTUARIA MEXICANA S..A.. DE C..,INFRAESTRUCTURA PORTUARIA MEXICANA S..A.. DE C..V,N 22°28'26",W 097°53'03",,2004-05-31 00:00:00,,,,
MXESE,,EIT,ENSENADA INTL TERMINAL SA DE CV,ADMINISTRACION PORTUARIA INTEGRAL DEENSENADA SA DE CV,N 31°51'06",W 116°37'45",,2004-05-31 00:00:00,,,,
MXLZC,,APMT,APM TERMINALS LAZARO CARDENAS TERMINAL DE CONTENEDORES II,APM TERMINALS LAZARO CARDENAS S..A.. DE C..V..,N 17°58'28",W 102°10'21",,2017-11-07 00:00:00,,http://www..puertolazarocardenas..com,,
MXLZC,,LCT,LAZARO CARDENAS TERMINAL PORTUARIA I,LAZARO CARDENAS TERMINAL PORTUARIA DE CONTENEDORES., S..A.. DE CV,N 17°57'12",W 102°10'18",,2004-05-31 00:00:00,,http://www..puertolazarocardenas..com,,
MXMZT,,TMAZ,TERMINAL MARITIMA DE MAZATLAN,TERMINAL MARITIMA DE MAZATLAN,N 23°11'36",W 106°24'54",1579824000000000000,2016-06-06 00:00:00,,https://www..tmaz..com..mx//english/,,
MXPGO,,TCY,ADMINISTR.. PORTUARIA INTEGRAL DE PROGRESO,TERMINAL DE CONTENEDORES DE YUCATAN SA DE CV,N 21°20'46",W 089°40'38",,2004-05-31 00:00:00,,,,
MXTAP,,PMD,PUERTO CHIAPAS,PUERTO CHIAPAS,N 14°42'38",W 092°24'05",1582934400000000000,2016-09-12 00:00:00,,http://www..puertochiapas..com..mx/,,
MXTUX,,TPT,TUXPAN PORT TERMINAL,TUXPAN PORT TERMINAL SA DE CV,N 20°57'29",W 097°19'32",,2019-10-04 00:00:00,,https://www..tpt..mx/,,
MXVER,,ICAVE,INTERNACIONAL DE CONTENEDORES ASOCIADOS DE VERACRUZ (ICAVE),INTERNACIONAL DE CONTENEDORES ASOCIADOS DE VERACRUZ,N 19°12'44",W 096°08'03",1575590400000000000,2004-05-31 00:00:00,1577750400000000000,,,
MXVER,,ICAVE,INTERNACIONAL DE CONTENEDORES ASOCIADOS DE VERACRUZ (ICAVE) TEC II,INTERNACIONAL DE CONTENEDORES ASOCIADOS DE VERACRUZ S..A.. DE C..V.. (HUTCHISON),N 19°14'20",W 096°10'12",,2020-01-01 00:00:00,,https://hutchisonportsicave..com/en/,Terminal Especializada de Contenedores., Zona de Ampliación del Nuevo Puerto de Veracruz., Mexico,
MXZLO,,CMSA,CONTECON MANZANILLO,CONTECON MANZANILLO., S..A DE C..V,N 19°05'05",W 104°18'09",,2016-05-13 00:00:00,,http://www..contecon..mx,,
MXZLO,,SSAMX,SSA MEXICO HOLDINGS,SSA MEXICO HOLDINGS SA DE CV,N 19°04'20",W 104°17'27",,2004-05-31 00:00:00,,,,
MXZLO,,TIMSA,TERMINAL INTL DE MANZANILLO (TIMSA),TERMINAL INT DE MANZANILLO SA DE CV TIMSA,N 19°03'37",W 104°17'35",,2004-05-31 00:00:00,,,,
MYPEN,,PENP,PENANG PORT,PENANG PORT SDN.. BHD.. PENANG,N 05°25'18",E 100°22'02",,2014-07-10 00:00:00,,,,
MYPGU,,JPB,JOHOR PORT,JOHOR PORT BERHAD,N 01°26'14",E 103°53'23",1576195200000000000,2015-06-12 00:00:00,,http://www..johorport..com..my,,
MYPKG,,NPM,NORTH PORT MALAYSIA,NORTH PORT MALAYSIA,N 03°02'14",E 101°21'26",,2004-05-31 00:00:00,,,,
MYPKG,,KMT,WESTPORT KELANG MULTI TERMINAL (KMT),KELANG MULTI TERMINAL (KMT),N 02°56'06",E 101°17'42",1579824000000000000,2004-05-31 00:00:00,,,,
MYTPP,,PTP,PORT OF TANJUNG PELEPAS,PORT OF TANJUNG PELEPAS,N 01°21'45",E 103°32'45",,2004-05-31 00:00:00,,,,
MZMPM,,MIPS,DP WORLD MAPUTO,DP WORLD,S 25°57'42",E 032°32'46",1579824000000000000,2005-09-19 00:00:00,,http://www..dpworldmaputo..com/,,MIPS was renamed to DP World Maputo in 2008
NAWVB,,WVB ,WALVIS BAY OCEAN TERMINAL,WALVIS BAY OCEAN TERMINAL,S 22°57'04",E 014°29'48",1579824000000000000,2015-09-22 00:00:00,,https://www..namport..com..na/ports/welcome-to-the-port-of-walvis-bay/522/,,
NGAPP,,APMTER ,APM TERMINALS APAPA,APM TERMINALS APAPA LTD..,N 06°26'09",E 003°23'18",1579824000000000000,2015-10-09 00:00:00,,https://www..apmterminals..com/apapa,,
NGPHC,NGONN,APMT,WEST AFRICA CONTAINER TERMINAL (ONNE PORT COMPLEX),APM TERMINALS,N 04°42'15",E 007°09'20",,2018-09-05 00:00:00,,https://www..apmterminals..com/en/operations/africa-middle-east/onne,,
NGTIN,,FIVEST,FIVE STAR TERMINAL TIN CAN ISLAND,FIVE STAR (TIN CAN ISLAND),N 06°25'47",E 003°20'27",1582934400000000000,2015-09-22 00:00:00,,http://www..exaf..fr/exaf/ports-description-nigeria#TCImap,,Berths 9-10
NGTIN,,TICT,TIN CAN ISLAND CONTAINER TERMINAL (TICT),TIN CAN ISLAND TERMINAL / BOLLORÉ PORTS,N 06°25'57",E 003°21'09",1582934400000000000,2015-09-22 00:00:00,,http://www..exaf..fr/exaf/ports-description-nigeria#TCImap,,Berths 3-5
NICIO,,EPN,PORT OF CORINTO,EMPRESA PORTUARIA NACIONAL,N 12°28'57",W 087°10'04",,2004-05-31 00:00:00,,,,
NLAMS,,ACT,AMSTERDAM CONTAINER TERMINAL (ACT),AMSTERDAM CONTAINER TERMINALS BV,N 52°25'19",E 004°46'01",1579824000000000000,2009-03-20 00:00:00,,https://hutchisonports..com/en/ports/world/amsterdam-container-terminals-act/,Ruijgoordweg 100., Harbor number 7991., 1047 HM Amsterdam., The Netherlands,
NLRTM,,APM,APM TERMINALS ROTTERDAM,APM TERMINALS,N 51°57'27",E 004°02'45",1574035200000000000,2014-08-05 00:00:00,,https://www..apmterminals..com/en/rotterdam,Coloradoweg 50., Port number 8203., 3199 LA Maasvlakte-Rotterdam., The Netherlands,
NLRTM,,NLMVII,APM TERMINALS ROTTERDAM MAASVLAKTE 2,APM TERMINALS,N 51°57'15",E 004°00'12",1574035200000000000,2014-08-26 00:00:00,,https://www..apmterminals..com/en/maasvlakte,Europaweg 910., Port number 8410., 3199 LC Maasvlakte-Rotterdam., The Netherlands,
NLRTM,,RTMB,BARGE CENTER WAALHAVEN (BCW),RTM-BARGE CENTER-WAALHAVEN,N 51°52'54",E 004°26'08",1574035200000000000,2005-02-23 00:00:00,,https://www..bargecenterwaalhaven..nl,Waalhaven West Zijde 62., Port number 2503., 3089 KR Rotterdam., The Netherlands,
NLRTM,,5049,BERTH 5049,HOLLAND TERMINALS,N 51°52'47",E 004°14'23",1574035200000000000,2005-08-24 00:00:00,,https://www..waalhavenbotlekterminal..nl/terminal/,Nieuwesluisweg 268., Port number 5049., 3197 KV Rotterdam., The Netherlands,
NLRTM,,HCD,ECT CITY TERMINAL HCD,ECT CITY TERMINAL BV,,,1574035200000000000,2007-10-25 00:00:00,1575072000000000000,https://www..ect..nl,,
NLRTM,,DBF,ECT DELTA BARGE FEEDER TERMINAL (DBF),ECT DELTA TERMINAL,N 51°57'20",E 004°04'30",1574035200000000000,2007-10-25 00:00:00,,https://www..ect..nl,Europaweg 875., Port number 8200., 3199 LD Rotterdam (Maasvlakte)., The Netherlands,
NLRTM,,DDE,ECT DELTA DEDICATED EAST (DDE),ECT DELTA TERMINAL,N 51°57'01",E 004°03'51",1574035200000000000,2007-10-25 00:00:00,,https://www..ect..nl,Europaweg 875., Port number 8200., 3199 LD Rotterdam (Maasvlakte)., The Netherlands,
NLRTM,,DDN,ECT DELTA DEDICATED NORTH (DDN),ECT DELTA TERMINAL,N 51°57'32",E 004°03'53",1574035200000000000,2007-10-25 00:00:00,,https://www..ect..nl,Europaweg 875., Port number 8200., 3199 LD Rotterdam (Maasvlakte)., The Netherlands,
NLRTM,,DCD,ECT DELTA TERMINAL GATE,ECT DELTA TERMINAL,N 51°57'16",E 004°01'43",1574035200000000000,2016-06-02 00:00:00,,https://www..ect..nl,Europaweg 875., Port number 8200., 3199 LD Rotterdam (Maasvlakte)., The Netherlands,Previously DELTA CONTAINER DIVISION (DCD)..
NLRTM,,EMX,ECT EUROMAX TERMINAL (EMX),ECT EUROMAX TERMINAL BV,N 51°58'27",E 004°02'17",1574035200000000000,2007-10-25 00:00:00,,https://www..ect..nl,Maasvlakteweg 951., Port number 9830., 3199 LZ Rotterdam (Maasvlakte)., The Netherlands,
NLRTM,,HAN,ECT HANNO WAALHAVEN TERMINAL,RTM-HANNO,,,1574035200000000000,2005-02-23 00:00:00,1575072000000000000,,,
NLRTM,,INTER,INTERFOREST TERMINAL ROTTERDAM,INTERFOREST TERMINAL ROTTERDAM,N 51°52'54",E 004°23'57",1574035200000000000,2014-08-05 00:00:00,,https://www..matransrotterdamterminal..com,Streefwaalseweg 15., 3195 KN Pernis Rotterdam., The Netherlands,
NLRTM,,LPL,LOSPLAATS WAALHAVEN,OVERBEEK CONTAINER CONTROL,,,1574035200000000000,2008-11-19 00:00:00,1575072000000000000,,,
