UNLOCODE,Alternative UNLOCODEs,Terminal Code,Terminal Facility Name,Terminal Company Name,Latitude (DMS),Longitude (DMS),Last change,Valid from,Valid until,Terminal Website,Terminal Address,Remarks
AEAUH,,ADT,KHALIFA PORT CONTAINER TERMINAL,ABU DHABI TERMINALS,N 24°48'37",E 054°38'46",,2015-05-03 00:00:00,,https://www..adterminals..ae,Khalifa Port Container Terminal Building 70 Taweelah - Abu Dhabi - U..A..E..,
AEJEA,,DPWJA,DP WORLD JEBEL ALI - CT1,DP WORLD JEBEL ALI,N 24°59'32",E 055°03'58",,2012-10-05 00:00:00,,,,
AEJEA,,DPWJ2,DP WORLD JEBEL ALI - CT2,DP WORLD JEBEL ALI,N 25°01'20",E 055°03'42",,2015-02-05 00:00:00,,,,
AEJEA,,DPWJ3,DP WORLD JEBEL ALI - CT3,DP WORLD JEBEL ALI,N 24°59'21",E 055°03'03",1578009600000000000,2015-02-05 00:00:00,,,,
AEJEA,,DPWJ4,DP WORLD JEBEL ALI - CT4,DP WORLD JEBEL ALI,N 25°01'57",E 055°03'06",,2019-06-04 00:00:00,,,,
AEKHL,AEAUH,KCT,COSCO SHIPPING PORTS ABU DHABI TERMINAL,CSP ABU DHABI TERMINAL LLC (ABU DHABI PORTS/COSCO SHIPPING PORTS),N 24°50'00",E 054°40'00",,2019-09-13 00:00:00,,http://www..cspadt..ae,CSP Abu Dhabi Terminal LLC., P..O Box 25530., Khalifa Port., Abu Dhabi., U..A..E..,
AEKLF,,KCTKLF,KHORFAKKAN CONTAINER TERMINAL,KHORFAKKAN CONTAINER TERMINAL,N 25°22'42",E 056°22'31",,2015-11-05 00:00:00,,https://www..gulftainer..com/terminals/uae/khorfakkan-container-terminal/,,
AESHJ,,SHJSCT,SHARJAH CONTAINER TERMINAL,GULFTAINER CO LTD - SHARJAH,N 25°21'29",E 055°22'15",,2019-03-19 00:00:00,,https://www..gulftainer..com/terminals/uae/sharjah-container-terminal/,,
AOLAD,,SOPO ,TERMINAL 5M - SOPORTOS,TERMINAL 5M - SOPORTOS,S 08°47'13",E 013°16'18",1578009600000000000,2015-09-22 00:00:00,,,,
ARBHI,,TBB,TERMINAL BAHIA BLANCA,TERMINAL BAHIA BLANCA,S 38°47'22",W 062°16'37",,2004-05-31 00:00:00,,,,
ARBUE,,BSAS,BS AS CONTAINER TERMINAL SERVICES SA,BS AS CONTAINER TERMINAL SERVICES SA,S 34°34'37",W 058°22'24",,2004-05-31 00:00:00,,,,
ARBUE,,EXOL,EXOLGAN SA BUE,EXOLGAN SA,S 34°38'24",W 058°20'48",,2004-05-31 00:00:00,,,,
ARBUE,,TERM4,TERMINAL 4,TERMINAL 4 SA,S 34°34'55",W 058°22'00",,2004-05-31 00:00:00,,,,
ARBUE,,TRP,TERMINALES RIO DE LA PLATA,TERMINALES RIO DE LA PLATA SA,S 34°35'05",W 058°21'47",,2005-09-19 00:00:00,,,,
ARLPS,,LPMOL,LAS PALMAS MOLCA,TERMINAL LAS PALMAS MOLCA,S 34°01'16",W 059°07'39",,2004-05-31 00:00:00,,,,
ARMDQ,,COOTR,COOTRAPORT LTDA,COOTRAPORT LTDA,S 38°02'49",W 057°32'11",,2004-05-31 00:00:00,,,,
ARPMY,,PUPUB,PTO PUBLICO,PUERTO PUBLICO & LOGINTER,S 42°44'10",W 065°02'19",,2004-05-31 00:00:00,,,,
ARPUD,,COSTA,COSTANERA SA,COSTANERA SA,S 47°45'13",W 065°54'40",,2004-05-31 00:00:00,,,,
ARPUD,,PUDES,PUERTO DESEADO,COSTANERA SA,S 47°45'13",W 065°54'40",,2004-05-31 00:00:00,,,,
ARROS,,TROSA,TERMINAL ROSARIO,TERMINAL ROSARIO,S 32°58'36",W 060°37'05",,2004-05-31 00:00:00,,,,
ARSAE,,TSP,TSP PATAGONIA NORTE SATERMINAL DE SERVICIOS PORTUARIOS,TSP PATAGONIA NORTE SATERMINAL DE SERVICIOS PORTUARIOS,S 40°47'57",W 064°52'57",,2004-05-31 00:00:00,,,,
ARUSH,,PLS,PATAGONIA LOGISTIC SOLUTIONS SA,PATAGONIA LOGISTIC SOLUTIONS SA,S 54°48'32",W 068°18'12",,2004-05-31 00:00:00,,,,
ARZAE,,TZARA,TERMINAL ZARATE,TZ TERMINALES PORTUARIAS,S 34°04'04",W 059°02'06",,2004-05-31 00:00:00,,,,
ASPPG,,PAGO,PORT OF PAGO-PAGO,PORT OF PAGO PAGO,S 14°16'36",W 170°41'05",,2004-05-31 00:00:00,,,,
AUADL,,DPWAD,ADELAIDE,DP WORLD (AUSTRALIA),,,1578009600000000000,2014-04-17 00:00:00,1580428800000000000,,,DP World sold their share of the container terminal to Flinders in July 2012..
AUADL,,FLACT,FLINDERS ADELAIDE CONTAINER TERMINAL,FLINDERS ADELAIDE CONTAINER TERMINAL,S 34°46'10",E 138°29'26",,2004-05-31 00:00:00,,,,
AUADL,,AATGH,OUTER HARBOUR,AUSTRALIAN AMALGAMATED TERMINALS,S 34°46'30",E 138°29'03",1578009600000000000,2014-04-17 00:00:00,1580428800000000000,,,AAT ceased to operate the RoRo terminal after the GM Holden factory closed down in 2017..
AUBEL,,PTBEL,BELL BAY,PATRICK,,,1585699200000000000,2001-06-26 00:00:00,1588204800000000000,,,No longer active (see 1-Stop terminal code list published 2018-09-25)..
AUBEL,,CONBE,QUBE PORTS BELL BAY,QUBE PORTS (NO..1) PTY LTD,S 41°08'22",E 146°51'17",,2014-04-17 00:00:00,,https://qube..com..au/about/locations/,1 Mobil Road., Bell Bay., TAS 7253., Australia,Berths 5-6
AUBNE,,AATFI,AAT BRISBANE FISHERMAN ISLANDS CARGO TERMINAL,AUSTRALIAN AMALGAMATED TERMINALS,S 27°22'44",E 153°09'59",1574035200000000000,2014-04-17 00:00:00,,https://www..aaterminals..com..au/location-fisherman/,Berth 3., Port Drive., Port of Brisbane., QLD 4178., Australia,Wharves 1-3
AUBNE,,DPBNE,DP WORLD BRISBANE FISHERMAN ISLANDS,DP WORLD (AUSTRALIA),S 27°22'23",E 153°10'14",1574035200000000000,2014-03-14 00:00:00,,https://www..dpworldaustralia..com..au/our-locations/brisbane/,Wharf 4., Port Drive., Fisherman Islands., Port of Brisbane., QLD 4178., Australia,Wharves 4-7
AUBNE,,HPAFI,HUTCHISON BRISBANE CONTAINER TERMINALS (BCT),BRISBANE CONTAINER TERMINALS PTY LTD (BCT)., HUTCHISON,S 27°21'36",E 153°10'48",1574035200000000000,2015-03-10 00:00:00,,https://www..hutchisonports..com..au/hutchisonports-brisbane/,Berth 11., Peregrine Drive., Port of Brisbane., PO Box 1203., Wynnum QLD 4178., Australia,Wharves 11-12
AUBNE,,PTMAR,MARITIME WHARF., HAMILTON,PATRICK,S 27°26'39",E 153°04'51",1574035200000000000,2001-06-26 00:00:00,1575072000000000000,,MacArthur Ave., Hamilton., Brisbane., QLD 4007., Australia,Terminal permanently closed., converted to "Eat Street Northshore"..
AUBNE,,ASFI3,PATRICK BRISBANE AUTOSTRAD TERMINAL,PATRICK,,,1574035200000000000,2001-06-26 00:00:00,1596153600000000000,http://www..patrick..com..au/operations,Berth 10., Curlew St., Port of Brisbane., QLD 4178., Australia,Code change from "ASFI3" to "PTFIT" after the Autostrad was introduced..
AUBNE,,PTFIT,PATRICK BRISBANE AUTOSTRAD TERMINAL,PATRICK,S 27°21'58",E 153°10'33",1574035200000000000,2001-06-26 00:00:00,,http://www..patrick..com..au/operations,Berth 10., Curlew St., Port of Brisbane., QLD 4178., Australia,Wharves 8-10
AUBWT,,CONBN,BURNIE,P&O AUTOMOTIVE & GENERAL STEVEDORING,,,,2014-04-17 00:00:00,,,,
AUBWT,,PTBUR,BURNIE,PATRICK,,,1585699200000000000,2004-05-31 00:00:00,1588204800000000000,,,No longer active (see the 1-Stop terminal code list published on 2018-09-25)..
AUDRW,,PATEAP,EAST ARM PORT,PATRICK GENERAL STEVEDORING,,,1585699200000000000,2015-03-10 00:00:00,1588204800000000000,https://www..darwinport..com..au/,,No longer operated by Patrick (see the 1-STOP terminal code list published on 2017-07-31)..
AUDRW,,CONDW,QUBE PORTS DARWIN,QUBE PORTS PTY LTD,S 12°29'24",E 130°52'50",,2014-04-17 00:00:00,,https://www..darwinport..com..au/,,
AUFRE,,CONFR,DP WORLD FREMANTLE,DP WORLD (AUSTRALIA),S 32°02'49",E 115°44'30",1574035200000000000,2014-04-17 00:00:00,,https://www..dpworldaustralia..com..au/our-locations/fremantle/,Berths 4/5/6 North Quay., Rudderham Drive., North Fremantle WA 6159., Australia,
AUFRE,,ASLFR,PATRICK FREMANTLE CONTAINER TERMINAL,PATRICK,S 32°02'35",E 115°44'43",1574035200000000000,2004-05-31 00:00:00,,http://www..patrick..com..au/operations,Berth 7., Port Beach Rd., North Fremantle WA 6159., Australia,
AUGEX,,PATGP,PATRICK GEELONG TERMINAL,PATRICK STEVEDORING PTY LTD,,,1585699200000000000,2014-06-10 00:00:00,1588204800000000000,,,No longer operated by Patrick (see the 1-Stop terminal code list published on 2017-07-31)..
AUGLT,,CONGL,GLADSTONE,P&O AUTOMOTIVE & GENERAL STEVEDORING,,,,2014-04-17 00:00:00,,,,
AUHLT,,CONHM,HAMILTON,P&O AUTOMOTIVE & GENERAL STEVEDORING,,,1582934400000000000,2014-04-17 00:00:00,1585612800000000000,,,AUHLT (Hamilton., VIC) is an inland location and thus does not qualify for the SMDG terminal code list..
AUMEL,,CONWS,DP WORLD WEST SWANSON DOCK TERMINAL,DP WORLD (AUSTRALIA),S 37°48'50",E 144°54'43",1574035200000000000,2014-04-17 00:00:00,,,Mackenzie Rd., West Melbourne VIC 3003., Australia,
AUMEL,,ASES1,PATRICK EAST SWANSON DOCK TERMINAL,PATRICK,S 37°48'50",E 144°54'55",1578009600000000000,2004-05-31 00:00:00,,,,
AUMEL,,PATMB,PATRICK TERMINAL MELBOURNE,PATRICK STEVEDORES OPERATIONS PTY LTD..,,,,2004-05-31 00:00:00,1596153600000000000,,,
AUMEL,,CONMEL,QUBE PORTS APPLETON DOCK,QUBE PORTS PTY LTD,S 37°49'02",E 144°55'15",,2014-04-17 00:00:00,,,,
AUMEL,,VICTM,VICT WEBB DOCK EAST,VICTORIA INTERNATIONAL CONTAINER TERMINAL,S 37°50'49",E 144°54'39",1574035200000000000,2017-04-26 00:00:00,,https://www..vict..com..au/,78 Webb Dock Dr., Port Melbourne VIC 3207., Australia,
AUMEL,,NTLWD,WEBB DOCK,PATRICK,,,,2004-05-31 00:00:00,,,,
AUMEL,,AATWD,WEBB DOCK WEST,AUSTRALIAN AMALGAMATED TERMINALS,,,1585699200000000000,2014-04-17 00:00:00,1588204800000000000,,,No longer active (see 1-Stop terminal code list published 2018-09-25)..
AUPKL,,AATPK,AAT PORT KEMBLA,AUSTRALIAN AMALGAMATED TERMINALS,S 34°27'17",E 150°53'19",,2004-05-31 00:00:00,,,,Berths 103.,105.,106.,107
AUPKL,,POPPK,PORT KEMBLA,P&O AUTOMOTIVE & GENERAL STEVEDORING,,,,2014-04-17 00:00:00,,,,
AUSYD,,CONDH,DARLING HARBOUR,P&O AUTOMOTIVE & GENERAL STEVEDORING,,,1576195200000000000,2014-04-17 00:00:00,1577750400000000000,,,Ceased to operate as a cargo wharf in 2007..
AUSYD,,PATDH,DARLING HARBOUR,PATRICK,,,1576195200000000000,2004-05-31 00:00:00,1577750400000000000,,,Ceased to operate as a cargo wharf in 2007..
AUSYD,,CTLPB,DP WORLD SYDNEY,DP WORLD (AUSTRALIA),S 33°58'15",E 151°12'59",1576195200000000000,2004-05-31 00:00:00,,https://www..dpworldaustralia..com..au/our-locations/sydney/,42 Friendship Rd., Port Botany NSW 2036., Australia,
AUSYD,,AATGI,GLEBE ISLAND,AUSTRALIAN AMALGAMATED TERMINALS,,,1585699200000000000,2014-04-17 00:00:00,1588204800000000000,,,Dry bulk only., no containerized cargo..
AUSYD,,CONGI,GLEBE ISLAND,P&O AUTOMOTIVE & GENERAL STEVEDORING,,,1585699200000000000,2014-04-17 00:00:00,1588204800000000000,,,Dry bulk only., no containerized cargo..
AUSYD,,HPAPB,HUTCHISON SYDNEY INTERNATIONAL CONTAINER TERMINAL (SICTL),SYDNEY INTERNATIONAL CONTAINER TERMINALS PTY LTD (SICTL),S 33°57'49",E 151°12'02",1576195200000000000,2015-03-10 00:00:00,,https://www..hutchisonports..com..au/hutchisonports-sydney/,Gates B150-160 Foreshore Road., Botany NSW 2019., Australia,
AUSYD,,ASLPB,PATRICK SYDNEY AUTOSTRAD TERMINAL,PATRICK,S 33°58'08",E 151°12'38",1576195200000000000,2004-05-31 00:00:00,,http://www..patrick..com..au/operations,Gate B110 Penrhyn Road., Port Botany NSW 2036., Australia,
AUSYD,,CONWB,WHITE BAY,P&O AUTOMOTIVE & GENERAL STEVEDORING,,,1585699200000000000,2004-05-31 00:00:00,1588204800000000000,,,No longer a cargo terminal., now used as cruise terminal..
AWORJ,,AWBAR,BARCADERA CONTAINER TERMINAL,ARUBA STEVEDORING COMPANY (ASTEC) N..V..,N 12°28'47",W 069°59'50",1582934400000000000,2016-09-19 00:00:00,,https://www..arubaports..com/main/barcadera/,,
AWORJ,,ASTEC,PORT OF ORANJESTAD,ARUBA PORTS AUTHORITY N..V..,N 12°31'21",W 070°02'47",1582934400000000000,2004-05-31 00:00:00,,https://www..arubaports..com/main/oranjestad/,,Container operations moved to Barcadera..
BDCGP,,BDPORT,CHITTAGONG PORT,CHITTAGONG PORT AUTHORITY,N 22°18'19",E 091°47'55",1585699200000000000,2015-05-03 00:00:00,,http://www..cpa..gov..bd/,,Three terminals (GCB., CCT., NCT)., but only one operator (Chittagong Port Authority)
BDMUN,,SAPLRT,SAPL INLAND WATER CONTAINER TERMINAL,SUMMIT ALLIANCE PORT LIMITED,N 23°34'27",E 090°30'43",,2019-12-06 00:00:00,,https://www..saplbd..com,West Muktarpur., Panchashar., Munshiganj - 1500., Bangladesh,
BEANR,,242,6TH HARBOUR DOCK / HANSA DOCK TERMINAL,DP WORLD (ANTWERP),,,1585699200000000000,2014-04-17 00:00:00,1588204800000000000,,,DP World moved to Deurganckdok., K1700.. As of 2020., K242 is operated by Sea-Tank Terminal..
BEANR,,314,7TH HARBOUR DOCK,DP WORLD (ANTWERP),,,1585699200000000000,2014-04-17 00:00:00,1588204800000000000,,,DP World moved to Deurganckdok., K1700.. As of 2020., K314 is operated by Sea-Tank Terminal..
BEANR,,ANM,ANR-MARITIME,PSA-HNN,,,1578009600000000000,2005-02-23 00:00:00,1580428800000000000,,,
BEANR,,ACOT,ANTWERP CONTAINER TERMINAL (K730),ANTWERP CONTAINER TERMINAL - SEA INVEST,N 51°19'27",E 004°20'47",,2019-07-05 00:00:00,,https://www..sea-invest..com,Sea-invest., 730., Antwerpsebaan 57., 2040 Antwerp., Belgium,
BEANR,,AET,ANTWERP EUROTERMINAL NV (K1329-K1347),ANTWERP EUROTERMINAL NV,N 51°16'23",E 004°12'12",,2016-07-26 00:00:00,,https://www..portofantwerp..com/en/node/4081,AET., 1329-1347., Blikken 1333., 9130 Verrebroek., Belgium,
BEANR,,1700,ANTWERP GATEWAY TERMINAL (K1700-K1710),DP WORLD (ANTWERP),N 51°17'31",E 004°15'56",1578009600000000000,2014-04-17 00:00:00,,http://www..dpworldantwerp..com/our-businesses/antwerp-gateway,DP World Antwerp., 1700-1710., Molenweg Haven 1950., 9130 Doel., Belgium,
BEANR,,BNFW,BELGIAN NEW FRUIT WHARF (K206-K212),SEA-INVEST FRUIT AND FOOD DIVISION - BNFW,N 51°15'42",E 004°22'42",1578009600000000000,2015-10-30 00:00:00,,,,
BEANR,,K420,CHURCHILL TERMINAL (K402-K428),PSA-ANTWERP,N 51°16'44",E 004°21'55",1578009600000000000,2014-07-14 00:00:00,,https://www..portofantwerp..com/en/node/4094,PSA Antwerp., 408-416., Wilmarsstraat 7., 2030 Antwerp., Belgium,
BEANR,,736,DELWAIDE DOCK TERMINAL,DP WORLD (ANTWERP),,,1564099200000000000,2014-04-17 00:00:00,1564099200000000000,,,DP World moved to Deurganckdok., K1700.. As of 2020., K736 is operated by Zuidnatje..
BEANR,,742,DELWAIDE DOCK TERMINAL FACILITY,DP WORLD (ANTWERP),,,1564099200000000000,2014-04-17 00:00:00,1564099200000000000,,,DP World moved to Deurganckdok., K1700.. As of 2020., K742 is operated by Mexiconatie..
BEANR,,K869,EUROPA TERMINAL (K851-K869),PSA-ANTWERP,N 51°20'18",E 004°16'34",1578009600000000000,2014-07-14 00:00:00,,https://www..portofantwerp..com/en/node/4092,PSA Antwerp., 851-869., Scheldelaan 495., 2040 Antwerp., Belgium,
BEANR,,K730,HOME TERMINAL (K702-K730),MSC,,,1564099200000000000,2014-07-14 00:00:00,1564099200000000000,,,MSC Home Terminal moved from Delwaide Dock to Deurganckdok (K1742/K1718)
BEANR,,K1742,MPET DEURGANCK DOCK (K1742),MSC PSA EUROPEAN TERMINAL,N 51°17'34",E 004°15'27",1578009600000000000,2014-07-14 00:00:00,,https://www..mpet..be/,Sint-Antoniusweg., 9130 Doel., Belgium,
BEANR,,K913,NOORDZEE TERMINAL (K903-K913),PSA-ANTWERP,N 51°21'03",E 004°15'55",1578009600000000000,2014-07-14 00:00:00,,https://www..portofantwerp..com/en/node/4091,PSA Antwerp., 901-913., Scheldelaan 601., 2040 Antwerp., Belgium,
BEANR,,OMEGA,OMEGA LOGISTICS K522,OMEGA,,,1578009600000000000,2005-01-25 00:00:00,1580428800000000000,,,
BEZEE,,Z206,OCHZ TERMINAL - K202-K207,PSA-ZEEBRUGGE,,,1582934400000000000,2014-07-14 00:00:00,1585612800000000000,,,PSA closed the terminal in 2015
BEZEE,,Z129,ZIP TERMINAL K129,PSA-ZEEBRUGGE,,,1582934400000000000,2014-07-14 00:00:00,1585612800000000000,,,PSA closed the terminal in 2015
BHBAH,BHKBS,POSU,APM TERMINALS BAHRAIN,APM TERMINALS BAHRAIN B..S..C.. (C),N 26°11'06",E 050°42'48",1579824000000000000,2015-09-21 00:00:00,,https://www..apmterminals..com/en/bahrain,,
BJCOO,,BTER,BENIN TERMINAL,PORT AUTONOME DE COTONOU / BOLLORÉ PORTS / APM TERMINALS,N 06°20'48",E 002°25'08",1588291200000000000,2015-09-22 00:00:00,,http://www..portcotonou..com/,,
BRFOR,,TOT,TERMACO OCEAN TERMINAL,TERMACO TERMINAIS MAR DE CONTAINERS E SERV ACES LTDA,S 03°42'35",W 038°28'27",1582934400000000000,2004-05-31 00:00:00,,,,
BRIBB,,TECIB,TECON IMBITUBA SA,TECON IMBITUBA SA,S 28°13'47",W 048°39'00",,2004-05-31 00:00:00,,,,
BRIOA,,ITP,ITAPOA TERMINAIS PORTUARIOS S/A,ITAPOA TERMINAIS PORTUARIOS S/A,S 26°10'56",W 048°36'19",,2004-05-31 00:00:00,,,,
BRITJ,,BRAITJ,APM TERMINALS ITAJAI,APM TERMINALS ITAJAI,S 26°54'05",W 048°39'52",1579824000000000000,2015-10-12 00:00:00,,https://www..apmterminals..com/en/itajai,,
BRITJ,,TECVI,TECONVI SA TERM CNTRS VALE ITAJAI,TECONVI SA TERM CNTRS VALE ITAJAI,S 26°54'06",W 048°39'51",,2004-05-31 00:00:00,,,,
BRITQ,,PCTN,PORT OF ITAQUI,EMAP - ITAQUI PORT AUTHORITY,S 02°34'36",W 044°22'12",,2019-10-18 00:00:00,,http://www..portodoitaqui..ma..gov..br,,
BRMAO,,CHINC,CHIBATAO NAVEGACAO E COMERCIO LTDA,CHIBATAO NAVEGACAO E COMERCIO LTDA,S 03°09'24",W 059°59'24",,2004-05-31 00:00:00,,,,
BRMAO,,SUPER,SUPER TERMINAIS,SUPER TERMINAIS COM E IND LTDA,S 03°08'59",W 059°59'54",,2004-05-31 00:00:00,,,,
BRNVT,,PTP,PORTONAVE SA TERMINAIS PORTUARIOS,PORTONAVE SA TERMINAIS PORTUARIOS,S 26°53'47",W 048°39'46",,2004-05-31 00:00:00,,,,
BRPEC,,BRAPEC,APM TERMINALS PECEM,APM TERMINALS PECEM OPERACOES PORTUARIAS LTDA,S 03°32'55",W 038°48'39",,2015-10-13 00:00:00,,,,
BRPEC,,CTO,CTO - CEARA TERMINAL OPERATOR,CTO-CEARA TERMINAL OPERATOR LTDA,S 03°32'55",W 038°48'39",,2004-05-31 00:00:00,,,,
BRPEC,,TECER,TECER TERM PORT CEARA LTDA,TECER TERM PORT CEARA LTDA,S 03°32'55",W 038°48'39",,2004-05-31 00:00:00,,,,
BRPNG,,TCP,TCP DE CONTEINERES DE PARANAGUA SA,TCP DE CONTEINERES DE PARANAGUA SA,S 25°30'10",W 048°30'07",,2004-05-31 00:00:00,,,,
BRRIG,,SUPMA,SUPERMAR SA,SUPERMAR SA,S 32°02'27",W 052°04'34",,2004-05-31 00:00:00,,,,
BRRIG,,TECRG,TECON RIO GRANDE SA,TECON RIO GRANDE SA,S 32°07'33",W 052°06'14",,2004-05-31 00:00:00,,,,
BRRIO,,LIBRJ,LIBRA TERMINAIS SA,LIBRA TERMINAIS SA,S 22°52'28",W 043°12'21",,2004-05-31 00:00:00,,,,
BRRIO,,MROP,MULTI RIO OPERACOES PORTUARIA SA,MULTI RIO OPERACOES PORTUARIA SA,S 22°52'37",W 043°12'27",,2004-05-31 00:00:00,,,,
BRSFS,,TESC,TESC TERMINAL SANTA CATARINA SA,TESC TERMINAL SANTA CATARINA SA,S 26°14'05",W 048°38'07",,2004-05-31 00:00:00,,,,
BRSLZ,,BRMAR,BRAZIL MARITIMA,BRAZIL MARITIMA LTDA - ME,S 02°34'40",W 044°22'09",,2004-05-31 00:00:00,,,,
BRSPB,,TECSE,SEPETIBA TECON SA,SEPETIBA TECON SA,S 22°55'50",W 043°50'18",,2004-05-31 00:00:00,,,,
BRSSA,,TECSV,TECON SALVADOR SA,TECON SALVADOR SA,S 12°57'28",W 038°30'25",,2004-05-31 00:00:00,,,,
BRSSZ,,BTP,BRASIL TERMINAL PORTUARIO S..A.. SANTOS,BRASIL TERMINAL PORTUARIO S..A.. SANTOS,S 23°55'19",W 046°21'10",,2014-07-22 00:00:00,,,,
BRSSZ,,ECOS,ECOPORTO SANTOS,ECOPORTO SANTOS,S 23°55'40",W 046°20'07",,2014-07-22 00:00:00,,,,
BRSSZ,,EMBRA,EMBRAPORT,EMBRAPORT EMPRESA BRASILEIRA,S 23°55'18",W 046°18'56",,2004-05-31 00:00:00,,,,
BRSSZ,,LIBSS,LIBRA TERMINAIS SA,LIBRA TERMINAIS SA,S 23°58'18",W 046°17'46",,2004-05-31 00:00:00,,,,
BRSSZ,,RODRI,RODRIMAR SA TRANSP EQUIP INDUSTRIAL,RODRIMAR SA TRANSP EQUIP INDUSTRIAL,S 23°55'35",W 046°20'28",,2004-05-31 00:00:00,,,,
BRSSZ,,SSA,SANTOS BRASIL SA,SANTOS BRASIL SA,S 23°57'45",W 046°17'36",,2004-05-31 00:00:00,,,,
BRSUA,,TECSU,TECON SUAPE SA,TECON SUAPE SA,S 08°23'35",W 034°58'03",,2004-05-31 00:00:00,,,,
BRVDC,,CONVI,CONVICON,CONVICON CONTEINERES DE VILA DO CONDE S/A,S 01°32'22",W 048°45'15",1554076800000000000,2004-05-31 00:00:00,,,,
BRVIX,,TDVV,TERMINAL DE VILA VELHA SA,TERMINAL DE VILA VELHA SA,S 20°19'28",W 040°19'44",,2004-05-31 00:00:00,,,,
CAHAL,,FCOVE ,FAIRVIEW COVE CONTAINER TERMINAL,CERES HALIFAX INC..,N 44°40'04",W 063°37'38",1579824000000000000,2015-01-29 00:00:00,,https://www..ceresglobal..com/locations/halifax..html,6708 Bayne Street., Halifax., Nova Scotia B3K 5M6., Canada,
CAHAL,,HAFXT,SOUTH END CONTAINER TERMINAL,PSA HALIFAX,N 44°37'42",W 063°33'45",1579824000000000000,2013-06-05 00:00:00,,https://www..portofhalifax..ca/facilities/hpa-facilities/psa-halifax-south-end-container-terminal/,577 Marginal Rd., Halifax., Nova Scotia B3H 4P6., Canada,
CAMTR,,MGTCAS,CAST TERMINAL (SECTION 77),MONTREAL GATEWAY TERMINALS,N 45°35'13",W 073°30'16",1579824000000000000,2015-02-19 00:00:00,,https://www..mtrtml..com/maps/index..php,,
CAMTR,,TMTMAI,MAISONNEUVE TERMINAL (SECTION 68),TERMONT TERMINAL INC,N 45°34'26",W 073°30'41",1579824000000000000,2015-02-19 00:00:00,,http://www..termont..com/,,
CAMTR,,MGTRAC,RACINE TERMINAL (SECTION 62),MONTREAL GATEWAY TERMINALS,N 45°33'57",W 073°31'07",1579824000000000000,2015-02-19 00:00:00,,https://www..mtrtml..com/maps/index..php,,
CAPRR,,FCTPRR,FAIRVIEW CONTAINER TERMINAL,DP WORLD,N 54°17'11",W 130°21'37",1579824000000000000,2018-03-07 00:00:00,,https://www..rupertport..com/terminal_details/fairview-container-terminal/,,
CAVAN,,CTM,CENTENNIAL TERMINAL (CENTERM),DP WORLD VANCOUVER,N 49°17'20",W 123°05'45",1579824000000000000,2016-08-12 00:00:00,,https://www..dpworld..ca/,777 Centennial Road., Vancouver., BC V6A 1A3., Canada,
CAVAN,,FSD,FRASER SURREY DOCKS,FRASER SURREY DOCKS LIMITED PARTNERSHIP,N 49°11'09",W 122°54'48",1579824000000000000,2004-05-31 00:00:00,,http://www..fsd..bc..ca/,11060 Elevator Rd., Surrey., BC V3V 2R7., Canada,
CAVAN,CADEL,DLT,GCT DELTAPORT,GCT CANADA LIMITED PARTNERSHIP,N 49°01'14",W 123°09'05",1579824000000000000,2006-08-28 00:00:00,,https://globalterminalscanada..com/contact/#Terminals,2 Roberts Bank Way., BC V4M 4G5., Canada,
CAVAN,,VTM,GCT VANTERM,GCT CANADA LIMITED PARTNERSHIP,N 49°17'19",W 123°04'26",1579824000000000000,2006-08-28 00:00:00,,https://globalterminalscanada..com/contact/#Terminals,1300 Stewart Street., BC V5L 4X5., Canada,
CGPNR,,CTPN,CONGO TERMINAL POINTE NOIRE,CONGO TERMINAL POINTE NOIRE / BOLLORÉ PORTS,S 04°47'30",E 011°49'48",,2016-05-13 00:00:00,,http://www..congo-terminal..net,,
CIABJ,,SETV1,VRIDI TERMINAL ABIDJAN,SOCIETE EXPLOITATION TERMINAL DE VRIDI (SETV) / BOLLORÉ PORTS / APM TERMINALS,N 05°16'25",W 004°00'48",1579824000000000000,2015-10-09 00:00:00,,http://www..abidjan-terminal..com/,,
CLANF,,ATI,ATI ANTOFAGASTA,ANTOFAGASTA TERMINAL INTERNACIONAL S..A..,S 23°39'00",W 070°24'29",,2004-05-31 00:00:00,,,,
CLANF,,EPA,EPA ANTOFAGASTA,EMPRESA PORTUARIA ANTOFAGASTA,S 23°39'00",W 070°24'17",,2004-05-31 00:00:00,,,,
CLARI,,TPA,TERMINAL PACIFICO ARICA,TERMINAL PUERTO ARICA S..A..,S 18°28'23",W 070°19'42",,2004-05-31 00:00:00,,,,
CLCNL,,CPC,PUERTO CORONEL,PUERTO DE CORONEL S..A..,S 37°02'02",W 073°09'10",,2016-09-01 00:00:00,,https://www..puertocoronel..cl,,
CLIQQ,,ITI,ITI IQUIQUE,IQUIQUE TERMINAL INTERNACIONAL S..A..,S 20°12'39",W 070°09'26",,2004-05-31 00:00:00,,,,
CLLQN,,PLIRQ,PUERTO LIRQUEN,PUERTO DE LIRQUEN S..A..,S 36°42'28",W 072°59'23",,2004-05-31 00:00:00,,,,
CLPAG,,PANGA,PUERTO ANGAMOS,COMPANIA PORTUARIA MEJILLONES S..A..,S 23°04'00",W 070°23'12",,2004-05-31 00:00:00,,,,
CLPUQ,,ART,TERMINAL ARTURO PRAT,EPAUSTRAL,S 53°10'11",W 070°54'24",1579824000000000000,2016-01-24 00:00:00,1580428800000000000,https://www..epaustral..cl,,
CLPUQ,,SMA,TERMINAL SANTOS MARDONES,EPAUSTRAL,S 53°07'32",W 070°51'31",1579824000000000000,2016-01-25 00:00:00,,https://www..epaustral..cl,,
CLSAI,,PCE,PUERTO CENTRAL SAN ANTONIO,PUERTO CENTRAL S..A..,S 33°35'30",W 071°37'00",,2016-09-16 00:00:00,,http://www..puertocentral..cl,,
CLSAI,,STI,STI SAN ANTONIO,SAN ANTONIO TERMINAL INTERNACIONAL S..A..,S 33°35'21",W 071°37'19",,2004-05-31 00:00:00,,,,
CLSVE,,SVTI,SVTI SAN VICENTE OCEAN TERMINAL,SAN VICENTE TERMINAL INTERNACIONAL,S 36°43'51",W 073°08'16",,2004-05-31 00:00:00,,,,
CLVAP,,EPV,EPV VALPARAISO,EMPRESA PORTUARIA DE VALPARAISO,S 33°02'13",W 071°37'33",,2004-05-31 00:00:00,,,,
CLVAP,,TPS,TPS VALPARAISO,TERMINAL PACIFICO SUR VALPARAISO SA..,S 33°01'54",W 071°37'38",,2004-05-31 00:00:00,,,,
CNCKG,,CUNTAN,CUNTAN TERMINAL,CHONGQING INTERNATIONAL CONTAINER TERMINAL CO..., LTD..,,,1585699200000000000,2015-05-03 00:00:00,1596153600000000000,http://www..cqgj..com..cn/,No.. 306., Hai'er Road., Jiangbei District., Chongqing., China,Replaced UNLOCODE CNCKG with CNCQI/CNCHQ..
CNCQI,CNCHQ,CUNTAN,CUNTAN TERMINAL,CHONGQING INTERNATIONAL CONTAINER TERMINAL CO..., LTD..,N 29°37'05",E 106°35'30",,2020-07-01 00:00:00,,http://www..cqgj..com..cn/,No.. 306., Hai'er Road., Jiangbei District., Chongqing., China,
CNCWN,,CHT,SHENZHEN CHIWAN HARBOUR CONTAINER CO..., LTD..,SHENZHEN CHIWAN HARBOUR CONTAINER CO..., LTD..,,,,2015-05-03 00:00:00,,,,
CNDCB,,DACHAN,DA CHAN BAY TERMINAL ONE,SHENZHEN DA CHAN BAY MODERN PORT DEVELOPMENT CO..., LTD..,N 22°32'00",E 113°51'20",,2015-09-21 00:00:00,,http://www..dcbterminals..com//en/,DaChan Bay Terminals., Xi Xiang., Bao An District., Shenzhen., China,
CNDLC,,DPCT,DALIAN CONTAINER TERMINAL,DALIAN CONTAINER TERMINAL CO..., LTD..,N 39°00'32",E 121°52'25",1585699200000000000,2004-05-31 00:00:00,,,Dayao Bay Port., Kai Fa District., Dalian., China,
CNFOC,,FICT,FUZHOU INTERNATIONAL CONTAINER TERMINAL,FUZHOU INTERNATIONAL CONTAINER TERMINAL,,,,2015-06-24 00:00:00,1596153600000000000,http://www..fct-fuzhou..com..cn/,Xin Jiang Road., Jiangyin., Fuqing Fujian., 350309., China,Replaced UNLOCODE CNFOC with CNFZH..
CNFOC,,FMP,FUZHOU QINGZHOU CONTAINER TERMINAL,FUZHOU QINGZHOU CONTAINER TERMINAL CO..., LTD,,,1585699200000000000,2015-06-24 00:00:00,1596153600000000000,http://www..fct-fuzhou..com..cn/,113 Luoxing Road Mawei., Fujian Fuzhou., 350015., China,Replaced UNLOCODE CNFOC with CNFZH..
CNFZH,,FICT,FUZHOU INTERNATIONAL CONTAINER TERMINAL,FUZHOU INTERNATIONAL CONTAINER TERMINAL,N 25°25'00",E 119°17'09",,2020-07-01 00:00:00,,http://www..fct-fuzhou..com..cn/,Xin Jiang Road., Jiangyin., Fuqing Fujian., 350309., China,
CNFZH,,FMP,FUZHOU QINGZHOU CONTAINER TERMINAL,FUZHOU QINGZHOU CONTAINER TERMINAL CO..., LTD,N 26°00'18",E 119°28'41",,2020-07-01 00:00:00,,http://www..fct-fuzhou..com..cn/,113 Luoxing Road Mawei., Fujian Fuzhou., 350015., China,
CNLYG,,LNOCT,LIANYUNGANG NEW ORIENTAL INTERNATIONAL CONTAINER TERMINAL,LIANYUNGANG NEW ORIENTAL INTERNATIONAL CONTAINER TERMINAL,N 34°44'43",E 119°25'40",1585699200000000000,2019-01-17 00:00:00,,http://www..lnoct..com,Miaoling Port., Lianyun District., Lianyungang., China,
CNLYG,,LPCT,LYG-PSA CONTAINER TERMINAL,LYG-PSA CONTAINER TERMINAL CO..., LTD..,N 34°44'52",E 119°26'12",1585699200000000000,2019-01-17 00:00:00,,http://www..lyg-psa..com,Miaoling Port., Lianyun District., Lianyungang., China,
CNNBO,CNNBG,BLCT1,NINGBO BEILUN INTERNATIONAL CONTAINER TERMINAL,NINGBO BEILUN INTERNATIONAL CONTAINER TERMINAL CO..., LTD..,N 29°56'10",E 121°52'00",1585699200000000000,2004-05-31 00:00:00,,http://www..nbct..com..cn/,No.. 178., North Pole Star Road., Beilun District., Ningbo., China,
